id,collection,dc.contributor.author,dc.contributor.editor,dc.date.issued,dc.description.abstract[],dc.description.abstract[en_US],dc.description.localcode[en_US],dc.description[en_US],dc.identifier.uri,dc.language.iso[en_US],dc.publisher[en_US],dc.rights.uri[*],dc.rights[*],dc.subject[en_US],dc.title.alternative[en_US],dc.title[en_US],dc.type[en_US]
"c64ab123-373c-43d8-9564-aaffe12eb09c","11250/152233","Ådnanes, Thomas Andrè",,"2024",,"The purpose of this study was to complete a curriculum inquiry into the presence of education for sustainable development in the curriculum of Norway and Wisconsin, and how objectives are formulated to promote it, through a comparative qualitative content analysis. The following overarching research question was employed: “How does curricula facilitate learning in education for sustainable development in social studies and other selected subjects in Norway and Wisconsin?”, with associated sub-questions. The study follows two of Goodlad´s (1979) five substantive domains of curriculum inquiry, the formal and perceived curriculum. In addition, an interpreted version of Eisner´s (1985) curriculum theory was utilized to examine whether the sustainability aspects were stated explicit or could be perceived implicit in the objectives. This was used to identify where sustainability can be found within the curricula, and where it is possible to be incorporated. The objectives where sustainability was identified are furthermore divided into which perspective they may have on learning. As the tension between the instrumental and emancipatory perspective on learning are presented in literature on education for sustainable
development as opposites poles of teaching, they were used in this categorization.
The analysis shows possible challenges teachers can encounter when educating for sustainable development. It highlights notable advantages and disadvantages with promoting explicit and implicit within the curriculum, where they both have a prominent presence. Likewise, both curricula rely on the instrumental and emancipatory perspective when it comes to sustainability education. The perspectives on learning may however be more nuanced than first anticipated, and how to best make use of both when educating for sustainable development are discussed.","MGUSA550","Master i grunnskolelærerutdanning 5. - 10. trinn, samfunnsfag. Høgskulen på Vestlandet","https://hdl.handle.net/11250/3153399","eng","Høgskulen på Vestlandet","http://creativecommons.org/licenses/by/4.0/deed.no","Navngivelse 4.0 Internasjonal","grunnskolelærerutdanning||samfunnsfag||bærekraft",,"Sustainability Education – Perspectives for the Future: A qualitative comparative study of education for sustainable development in Norway and Wisconsin","Master thesis"
"3bb86b2b-adeb-4de5-afc4-4cece30b1fa4","11250/152233","Røvang, Kristian",,"2024",,"Læreplanen legger føringer for undervisning og arbeidsmetoder. Knyttet til samfunnsfaget ønskes det mer aktive og utforskende elever. Denne masteroppgaven utforsker hvordan ekskursjoner kan være en verdifull undervisningsmetode, samt hvilke faktorer som bidrar til effektivitet. Formålet med denne studien er å finne ut hvordan ekskursjoner kan påvirke elevers engasjement og læring. For å finne svar på dette har jeg deltatt på to ulike ekskursjoner, i tillegg til å intervjue både elever og lærere i etterkant av disse observasjonene 
Elevene i undersøkelsen min forstår engasjement som «når noe er gøy». Dette er en interessant beskrivelse som ikke fremkommer i litteraturen. Lærerne forstår engasjement som det motsatte av å være likegyldig, og beskriver det som å være deltakende i undervisningen gjennom å vise interesse for faget. I lys av elevenes forståelse av engasjement, viser funnene i denne studien at det elevene opplever som «det gøyeste», er når arbeidsmetoden i ekskursjonen i hovedsak er lærerstyrt. Elevene forteller om spennende historier formidlet av svært interessante mennesker som virkelig har levd seg inn i historiefortellingene. Elevenes perspektiver kaster lys over opplæringsloven og læreplanens dybdelæring og utforskende tilnærminger, hvor mange elever opplever de passive delene i undervisningen som de mest engasjerende. 
Det kommer frem i denne studien at ekskursjoner benyttes av ulike grunner. Å utvikle elevenes sosiale ferdigheter ved ekskursjoner i kjente omgivelser nevnes som en årsak. En annen er variasjonen den medbringer. Både i form av at ekskursjoner kan legge til rette for en mer utforskende tilnærming enn hva klasserommet normalt gjør, i tillegg til at den kan benyttes til å imøtekomme ulike elevtyper. Slik kan den tilrettelegge for formålet i opplæringsloven (1998, §1-1). Litteraturen fremhever ekskursjoner som en utforskende og alternativ tilnærming til undervisningen, hvor elever kan utfolde sin nysgjerrighet utenfor klasserommets fire vegger, gjerne i samspill med andre. John Dewey var kritisk til den tradisjonelle kateterundervisningen, og mente den manglet forankring i den virkelige verden. Ekskursjoner, og nærmiljøet spesielt, kan derfor benyttes for å legge til rette for en undervisning som tar utgangspunkt i elevenes liv. For at ekskursjoner skal kunne oppnå dette, kreves det både for- og etterarbeid. Elever som er godt forberedt viser større mestringsfølelse og engasjement","MGUSA550","Master i grunnskolelærerutdanning 5. - 10. trinn, samfunnsfag. Høgskulen på Vestlandet","https://hdl.handle.net/11250/3154281","nob","Høgskulen på Vestlandet","http://creativecommons.org/licenses/by/4.0/deed.no","Navngivelse 4.0 Internasjonal","grunnskolelærerutdanning||samfunnsfag||ekskursjoner","Field trips and its effect on pupil engagement and learning","Ekskursjoner i lys av elevengasjement og læring","Master thesis"
"5a57cd06-1ac3-49ca-a64d-12751ae80cc5","11250/152233","Bartnes, Rikke Klokeide",,"2024",,"I 2013 ble Ludvigsen-utvalget nedsatt med det mandatet at de skulle undersøke daværende læreplanverk (LK06) opp mot fremtidens kompetansekrav. Anbefalingene fra Ludvigsenutvalget, gjennom hovedinnstillingen NOU 2015: 8 Fremtidens skole. Fornyelse av fag og kompetanser, la grunnlaget for Fagfornyelsen (LK20) som ble innført i 2020. Ludvigsenutvalget baserte anbefalingene sine på deres fortolkning av samfunnsutviklingen, forskning og skolens samfunnsoppdrag (danning og kvalifisering). Dette er det også flere organisasjoner og aktører som har hatt fokus fremtidige kompetansekrav. De siste tiårene har det nemlig blitt utviklet flere rammeverk over kompetanser elever bør mestre i fremtiden og det 21. århundre; disse benevnes som 21st century skills.Fokuset i denne oppgaven har vært på kompetansene jeg nevnte ovenfor, som jeg har valgt å kalle fremtidskompetanse. Oppgavens formål har vært todelt. Formålet har for det første vært å undersøke hvordan fremtidskompetanse er integrert i læreplanverket (LK20), med en innholdsanalyse av Overordnet del og læreplanen for samfunnsfag. Det andre formålet har vært å undersøke hvordan fremtidskompetanse diskursivt legitimeres eller rammes inn i NOU 2015: 8. Jeg har utført en diskursanalyse hovedsakelig basert på Laclau og Mouffes diskursteori for å undersøke diskursive innramminger.
Analysene mine viser at fremtidskompetanse i stor grad er integrert i læreplanverket, og gjennomsyrer både Overordnet del og læreplanen for samfunnsfag. Fra NOU 2015: 8 har jeg artikulert to diskurser som bygger på to ulike oppfatninger av læring, og basert på dette, av hvorfor fremtidskompetanse bør integreres i fremtidens skole. Den dominerende diskursen i utredningen – og den diskursen som tydeligst rammer inn fremtidskompetanse – er den jeg har valgt å kalle den nyliberale, samfunnsnytteorienterte diskursen. Dette er en diskurs som trekker på nyliberale ideer rundt utdanning og samfunnsøkonomisk nytte. Konkurransekraft, humankapital, ansvarliggjøring og individualisering er sentralt i diskursens syn på læring. En mindre tydelig diskurs ble også artikulert, men artikulasjonen av denne diskursen – som jeg valgte å kalle den danningsorienterte diskursen – baserte seg i størst grad på implikasjoner for elevenes danning. Ut fra diskursanalysen konkluderer jeg også med at fremtidskompetanse i størst grad henger sammen med skolens kvalifiseringsoppdrag, og at danningsoppdraget blir vagt.","MGUSA550","Master i grunnskolelærerutdanning 5. - 10. trinn, samfunnsfag. Høgskulen på Vestlandet","https://hdl.handle.net/11250/3154288","nob","Høgskulen på Vestlandet","http://creativecommons.org/licenses/by/4.0/deed.no","Navngivelse 4.0 Internasjonal","grunnskolelærerutdanning||samfunnsfag||fremtidskompetanse","Competencies for the future in the Norwegian school curriculum and discursive framings in NOU 2018: 5 The school of the future","Fremtidskompetanse i læreplanverket og diskursive innramminger i NOU 2018: 5 Fremtidens skole","Master thesis"
"3380c023-ccc5-4313-860f-1797f7475607","11250/152233","Berg, Sivert",,"2024",,"Er «Generasjon Greta Thunberg» død? Dennemasteroppgaven sikterprimært på å undersøke holdningertil klimaendringerog relaterte utfordringerhosunge lærerstudenter. Ved å undersøke holdninger kan man si mye om deres forståelse, tanker, følelser og adferd. Sekundærtundersøker studienåutforske om det er samsvar mellom disse holdningene og læreplanen, samthva lærerstudenteneønsker å prioritere i deresundervisning for bærekraftig utvikling. Dette aspektet er avgjørende for å forstå hvordan fremtidige lærere kan integrere klima-og miljøspørsmål i sine pedagogiske praksiser.
Studiener basert på et kvantitativt forskningsdesign. Dataeneerinnsamlet gjennomet nettbasert spørreskjema, survey, som er utviklet i SurveyXact. Spørreskjemaet ble gjennomført blant lærerstudenter vedHøgskulen på Vestlandet.
Resultater fra studien avdekker at de unge lærerstudentene generelt har positive klimaholdninger. Dette indikerer en viktig bevissthet blant den unge generasjonen og fremtidige lærere rundtde bærekraftigeutfordringeneverden står overfor. Imidlertid avslører undersøkelsenen bekymringsverdig trend: til tross for deres positive holdninger, følerstudentene lite håp og myebekymring. Denne dissonansen mellom holdninger og følelser kan ha konsekvenser for deres evne til å engasjere seg i effektiv handling for å bekjempe klimautfordringer.En lignende trend ser vi iundervisning,hvor respondentene rangerer forventningsfulle følelser lavest.Dette funnet kan være bekymringsverdig da enpositivemosjonell tilknytning viser seg å kunnebidra tilå utvikle blant annet handlingskompetansefor elever.
På bakgrunn av funnene istudien, kan man konkludere med at «Generasjon Greta Thunberg» enda ikkeerdød–men at det finnes noen utfordringer man burde være klar over. Oppgavenfremhever ogsåviktigheten av å utviklepedagogiske tilnærminger som ikke bare fremmer teoretisk kunnskap, men også forventningsfulle følelser som håp. Å adressere denne utfordringenkan være avgjørende for å mobilisere en ny generasjon av lærere.","MGUSA550","Master i grunnskolelærerutdanning 5. - 10. trinn, samfunnsfag. Høgskulen på Vestlandet","https://hdl.handle.net/11250/3154286","nob","Høgskulen på Vestlandet","http://creativecommons.org/licenses/by/4.0/deed.no","Navngivelse 4.0 Internasjonal","grunnskolelærerutdanning||samfunnsfag||klima||bærekraft","Is the Generation Greta Thunberg dead? A Quantitative Study of Teacher Students´ Attitudes Towards Climate Issues","Er generasjon Greta Thunberg død? En kvantitativ studie av lærerstudenter sine holdninger til klimaspørsmål","Master thesis"
"db1142de-1fa3-49d5-8f46-37a4e8fa193a","11250/2473201","Berg, Benedikte Aamland||Farsund, Aina Marie",,"2024",,"Denne masteroppgaven undersøker algoritmisk tenkning og kunstig intelligens (KI) i lys av de økende teknologiske kravene til befolkningens kompetanse som deltakende demokratiske borgere i det 21. århundret. Med innføringen av algoritmisk tenkning som del av kjerneelementet Utforsking og problemløsing i læreplanen (LK20), og lanseringen av den banebrytende språkmodellen ChatGPT av OpenAI i november 2022, har behovet for en integrert forståelse av kunstig intelligens og menneskelige ferdigheter blitt stadig mer viktig i undervisningssammenheng. Forskning på feltet tar stort sett for seg disse temaene isolert, selv om det finnes studier som understreker betydningen av å betrakte kunstig intelligens i sammenheng med menneskelig interaksjon. Til tross for den raske utviklingen, er det mangel på retningslinjer og forskning på hvordan elever kan bruke kunstig intelligens på en hensiktsmessig måte i undervisningen. Motivert av betydningen av algoritmisk tenkning og kunstig intelligens, presenterer denne masteroppgaven problemstillingen: Hvilke kjennetegn på algoritmisk tenkning kommer til uttrykk i grupper som jobber problemløsende i interaksjon med generativ kunstig intelligens? Studien belyser problemstillingen gjennom en kvalitativ tilnærming. Datamaterialet består av lydopptak fra fem parvise grupper, som jobber problemløsende og bruker kunstig intelligens som hjelpemiddel, samt tilhørende logger fra ChatGPT. Kjennetegn på algoritmisk tenkning ble observert ut ifra Shute et al. (2017) sitt rammeverk. Videre ble Mollick og Mollick (2023a) sitt rammeverk brukt for å analysere hvilken rolle ChatGPT hadde i sammenheng med de ulike kjennetegnene på algoritmisk tenkning som kom til uttrykk. Funnene indikerer at alle kjennetegnene på algoritmisk tenkning i henhold til Shute et al. (2017) observeres i varierende grad, med algoritmebehandling og feilsøking som de mest fremtredende. Det var lite variasjon mellom gruppene når det gjaldt hvor ofte forskjellige kjennetegn kom til uttrykk. Ut av de syv rollene beskrevet i Mollick og Mollick (2023a), var det tre roller som viste seg: verktøy, trener og simulator. Funnene i studien vår antyder at det er sammenheng mellom kjennetegnene på algoritmisk tenkning som kommer frem, og hvilken rolle ChatGPT har i interaksjonen. Studiens funn viser også at det kan være mulig å påvirke hvilke kjennetegn som kommer frem gjennom hvilken rolle ChatGPT har. Resultatene får også frem mangelen på kunnskap rundt bruken av store språkmodeller som ChatGPT i undervisningssammenheng","MGUMA550","Master i grunnskolelærerutdanning 5. -10. trinn, matematikk","https://hdl.handle.net/11250/3150103","nob","Høgskulen på Vestlandet","http://creativecommons.org/licenses/by/4.0/deed.no","Navngivelse 4.0 Internasjonal","grunnskolelærerutdanning||matematikk||KI","Characteristics of Computational Thinking in  Interaction with Generative Artificial Intelligence","Kjennetegn på algoritmisk tenkning i interaksjon med  generativ kunstig intelligens","Master thesis"
"f308450e-992f-4b82-93cc-16c8cfd9dadc","11250/2473201","Arnone, Martina Gran",,"2024",,"Jeg har undersøkt hvordan et norsk digitalt læremiddel i matematikk tilrettelegger for algebraisk tenkning på mellomtrinnet. Bakgrunnen for studien var blant annet de siste TIMSS- og PISA-undersøkelsene som indikerer at norske elever presterer under det internasjonale gjennomsnittet i matematikk og i algebra, samt anbefalinger i teori og forskningslitteratur om å integrere algebraisk tenkning på barnetrinnet. Anbefalingene er ment for å lette overgangen fra barneskole- til ungdomsskolematematikken og for å heve elevers kompetanse i matematikk og i algebra. Av den grunn ble det ansett som nyttig å undersøke muligheter for algebraisk tenkning som tilbys i et mye brukt digitalt læremiddel. Studien er sentrert rundt følgende forskningsspørsmål: «Hvordan legger det digitale læremiddelet Skolen 5-7 Matematikk fra Cappelen Damm til rette for algebraisk tenkning på mellomtrinnet?». For å besvare forskningsspørsmålet utførte jeg en innholdsanalyse av læremiddelet med hensyn til matematikkoppgaver i de såkalte læringsstiene innenfor alle tema for 5.- 6.- og 7.trinn. Innholdsanalysen ble utført i to steg. Det første steget innebar analyse og koding av oppgaver med mål om å identifisere oppgaver med kjennetegn på algebraisk tenkning i henhold til et analytisk rammeverk basert på definisjoner av tidlig algebraisk tenkning i teori og forskningslitteratur. Det andre steget innebar analyse og koding av oppgavene med kjennetegn på algebraisk tenkning med hensyn til hvilke kognitive krav de stilte til elevene. Målet var å avdekke læringsmuligheter i oppgavene basert på kognitive krav. Det aktuelle analytiske rammeverket var basert på et kjent rammeverk for identifikasjon av kognitive krav i matematikkoppgaver. Resultatene indikerte at mulighetene for algebraisk tenkning i oppgavene i læringsstiene var begrenset med hensyn til lav forekomst av oppgaver med kjennetegn på algebraisk tenkning og overvekt av lave kognitive krav blant disse oppgavene. Resultatene indikerte at det digitale læremiddelet vektla ulike algebraiske tenkemåter. Det var størst forekomst av oppgaver relatert til algebraisk tenkning som algebraisk løsning av likninger og ulikheter med ukjente. Oppgaver relatert til algebraisk tenkning som funksjosntenkning, modellering med algebra og generalisert aritmetikk ble også identifisert. Selv om det var størst forekomst av oppgaver med lave kognitive krav, så ble det også identifisert oppgaver innenfor høyere nivå av kognitive krav","MGUMA550","Master i grunnskolelærerutdanning 5. - 10. trinn, matematikk","https://hdl.handle.net/11250/3150085","nob","Høgskulen på Vestlandet","http://creativecommons.org/licenses/by/4.0/deed.no","Navngivelse 4.0 Internasjonal","grunnskolelærerutdanning||matematikk||algebra","Opportunities for algebraic thinking within one  Norwegian digital curriculum resource in  mathematics for the school years 5 to 7","Muligheter for algebraisk tenkning i et norsk  digitalt læremiddel i matematikk for  mellomtrinnet","Master thesis"
"4d0eda00-4885-4fe0-8bed-bce0af1994a3","11250/152233","Johannesen, Kristine",,"2024",,"Denne masteroppgaven undersøker fagforståelser i KRLE med bakgrunn i sentrale danningsperspektiver. Dette uttrykkes i oppgavens problemstilling: Hvordan er forholdet mellom fagforståelse i KRLE og danningsteori? Hensikten med denne oppgaven er å bidra på det religionsdidaktiske feltet, hvor mitt bidrag er å undersøke om det er en sammenheng mellom fagforståelse og forståelsen av danningsoppdraget som skolen er pålagt. Det finnes ulike måter å forstå ‘danning’ på, noe som betyr at danningsbegrepet kan oppfattes som et komplekst begrep. Det er også dette som gjør at danning er et høyaktuelt tema på lærerutdanningen, fordi det er et elastisk begrep som kan være vanskelig å forholde seg til for lærerne. For å belyse begrepets flertydighet utforsker denne oppgaven de idé-historiske tradisjonene ‘paideia’, ‘Bildung’ og ‘folkedanning’, som alle har påvirket det norske danningsbegrepet slik det er i dag. På grunn av feltets kompleksitet anvendes Wolfgang Klafkis teori om material-, formal- og kategorial danning som et redskap for å lettere skille mellom ulike danningsbegreper. Klafkis danningsteori er dermed et viktig verktøy for å systematisere danningsbegrepet til videre bruk. Oppgaven er hermeneutisk forankret, noe som reflekteres i min metodiske tilnærming i analysen. Dette er en kvalitativ studie hvor jeg bruker tekstanalyse som fremgangsmåte med fokus på innhold og ideer. Gjennom hermeneutisk tolkning forsøker jeg å avdekke fagforståelsen som reflekteres i tre utvalgte innføringsbøker i KRLE-didaktikk: Andreassen (2016), Fuglseth og Skrefsrud (2021) og Brekke (2023). Til dette brukes tematisk koding, hvor analysens kategorier og koder er basert på sentrale spørsmål fra den fagdidaktiske debatten om KRLE-faget. At tolkningsarbeidet er hermeneutisk betyr at analysen reflekterer mine subjektive fortolkninger. Jeg har imidlertid vektlagt relevans og rimelighet i tolkningene og forsøkt å tolke tekstene i beste mening ut fra det hermeneutiske barmhjertighetsprinsippet. I drøftingen diskuterer jeg fagforståelsen i lys av ulike danningsteoretiske perspektiver. Drøftingen er mitt forsøk på å sette fagforståelsene inn i en større sammenheng. Siden denne relasjonen ikke uttrykkes eksplisitt i materialet, lar det seg ikke gjøre å konkludere på entydig vis, men konklusjonen drar i retning av at de ulike fagforståelsene til en viss grad samsvarer med bestemte danningsteoretiske perspektiver. Dette oppsummerer mitt svar på oppgavens problemstilling","MGBKR550","Master i grunnskolelærerutdanning 1. - 7. trinn, KRLE. Høgskulen på Vestlandet, campus Bergen","https://hdl.handle.net/11250/3151124","nob","Høgskulen på Vestlandet","http://creativecommons.org/licenses/by/4.0/deed.no","Navngivelse 4.0 Internasjonal","grunnskolelærerutdanning||KRLE||fagforståelse||danning","The significance of the educational perspective for subject understanding:  A study of various subject understandings in KRLE viewed from the  perspective of formation (Bildung)","Fagforståelse og danningsperspektiver: En studie av fagforståelse i KRLE  vurdert i lys av sentrale perspektiver på danning","Master thesis"
"08f1cc6f-501e-481a-89d1-713cb1c36e66","11250/152233","Solberg, Nora Midttun",,"2024",,"I takt med at samfunnet endrer seg og blir mer mangfoldig, endrer også skolen seg. Mangfold er et begrep som står sentralt i norsk skole, samtidig er det usikkerhet rundt forståelsen av begrepet og hvordan man skal håndtere religiøst og kulturelt mangfold på best mulig måte i klasserommet. Temaet i denne masteroppgaven er «Lærerperspektiver på KRLE i klasser med stort religiøst og kulturelt mangfold». Jeg har undersøkt spesielt tre forskningsspørsmål. Hvilke forståelser av mangfold gir KRLE-lærerne i klasser med stort religiøst og kulturelt mangfold?, Hvilke arbeidsformer bruker KRLE-lærere i klasser med stort religiøst og kulturelt mangfold?, Og hvilke utfordringer og muligheter opplever KRLE-lærere i klasser med stort religiøst og kulturelt mangfold? Dette blir igjen delt inn i fire undertemaer for å svare på hovedtema. Mine informanter var to lærere fra ordinære klasser med stort religiøst og kulturelt mangfold i klassen, samt en innføringslærer. Samtidig som jeg da har fått svar på forskningsspørsmålene, var det også interessant hvordan innføringslærer og hens praksis skilte seg fra de to andre lærerne. I innføringsklasser må man tenke på en annen måte, samtidig som det er deler av denne praksisen som kan ha overføringsverdi til ordinære klasser. Funnene viste at det var mange ulike forståelser av mangfold. Dette ble vist gjennom lærernes tanker rundt mangfold, og gjennom forståelser i lovverk og teori. Ulike undersøkelser rundt mangfold av Anne Bonnevie Lund ble diskutert, og viste at lærere kunne se på mangfoldsbegrepet som upresist. Lærerne i oppgaven hadde nokså de samme arbeidsformene i undervisningen, med en variasjon mellom tavleundervisning, dialog mellom lærer og elever, samt individuelt arbeid og i noen tilfeller gruppearbeid. Samtidig skilte innføringslærer seg noe fra de to andre lærerne ved å blant annet ta i bruk morsmål i undervisningen. Datamaterialet knyttes opp mot Fuglseths teori om arbeidsformer i KRLE. Lærerne så på religiøst og kulturelt mangfold som en ressurs hvor mulighetene kunne være større åpenhet, toleranse og læring. Det var også med på å minske fremmedfrykt og bygget relasjoner. Her ble Nicolaisen og Østberg trukket inn, som snakket om viktigheten av å ta barnets livsverden på alvor, i tillegg til Lund som mente barn som føler seg anerkjent gjorde det bedre i skolen. Det var i motsetning større forskjeller rundt utfordringer. Språk kunne være en utfordring, hvor Lunds teori om viktigheten av språk og begrepsforståelse ble diskutert. Forskjeller og uenigheter blant elevene ble knyttet til Myrebøe og Røthing sin teori om grensesetting i klasserommet, og utfordringen rundt samarbeid med foreldre ble tatt opp. Lærerne var løsningsorienterte og jobbet med relasjoner, kommunikasjon og klassemiljø for å minske forskjeller og eventuelle utfordringer","MGBKR550","Master i grunnskolelærerutdanning 1. - 7. trinn, KRLE. Høgskulen på Vestlandet, campus Bergen","https://hdl.handle.net/11250/3151119","nob","Høgskulen på Vestlandet","http://creativecommons.org/licenses/by/4.0/deed.no","Navngivelse 4.0 Internasjonal","grunnskolelærerutdanning||KRLE||mangfold||kultur||religion","Teacher Perspectives on KRLE in Classes with Significant Religious and Cultural  Diversity","Lærerperspektiver på KRLE i klasser med stort religiøst og kulturelt  mangfold","Master thesis"
