id,collection,dc.contributor.advisor,dc.contributor.author,dc.date.issued,dc.description,dc.description.abstract,dc.description.abstract[en_US],dc.description[en_US],dc.identifier,dc.identifier.citation[en_US],dc.identifier.uri,dc.language,dc.language.iso[en_US],dc.publisher,dc.publisher[en_US],dc.rights.holder[en_US],dc.rights.uri[*],dc.rights[*],dc.source.pagenumber[en_US],dc.subject.nsi[en_US],dc.subject[en_US],dc.title,dc.title[en_US],dc.type,dc.type[en_US]
"44c1c3a5-da76-4b46-bdc5-c75ed3e1dd4e","11250/3034394","Østrem, Ketil||Bere, Elling Tufte","Lervik, Fredrik||Borø, Mathias Skarpeid","2023",,"Gjennom egen praksis og arbeidserfaring har vi erfart at store deler av undervisningen bærer 
preg av stillesitting i klasserommet og teoretisk vektlegging. Unntaket er såkalte praktiske fag 
som kunst & håndverk, mat og helse og kroppsøving. Gjennom kroppsøvingsfagets sentrale 
verdier og kjerneelement blir viktigheten av å komme seg ut i naturen i skolen synliggjort 
(Utdanningsdirektoratet, 2019). Denne studien har til hensikt å undersøke hvordan friluftsliv 
kan integreres i undervisningen for å styrke tverrfaglig læring, med fokus på faget 
kroppsøving. Vi vil analysere hvordan de tre tverrfaglige temaene i den overordnede 
læreplanen folkehelse og livsmestring, demokrati og medborgerskap, og bærekraftig utvikling
kan berikes gjennom friluftslivsundervisning.

Studien har et kvalitativt design og benytter seg av datainnsamlingsmetoden semistrukturert 
intervju. Utvalget består av tre kvinner og tre menn som alle har erfaring med undervisning i 
kroppsøvingsfaget. Lærerne innehar en bred kompetanse innenfor friluftsliv, ulik 
arbeidserfaring og ulike tilnærminger til faget. Analysearbeidet har tatt utgangspunkt i en 
etnografisk analysemetode som har til hensikt å tolke ulike mønstre og gjentatte handlinger i 
kvalitativ forskning.

Resultatene viser at de tverrfaglige temaene har stort potensial for å berike undervisningen og 
gi elevene nyttig kunnskap og praktisk erfaring. Informantene understreker bruk av naturen
som en ressurs for å rette søkelys på undervisning i bærekraftig utvikling og sporløs ferdsel, 
noe som bidrar til miljøbevissthet og bærekraftig utvikling i friluftslivsundervisningen. 
Medbestemmelse i friluftslivsundervisningen fremheves også som en nøkkelfaktor. Ved å gi 
elevene ansvarsoppgaver og inkludere dem i planleggingen, kan vi forbedre forståelsen av 
deres evner og erfaringer i emnet friluftsliv. Informantene uttrykker også at samarbeid og 
medborgerskap kan forbedres gjennom medbestemmelse i undervisningsprosessen. Studien 
konkluderer med at friluftslivsundervisning med fokus på tverrfaglige temaer har et stort 
potensial for å berike kroppsøvingsundervisningen, fremme bærekraftig utvikling og gi en 
mer praktisk og elevsentrert tilnærming til læring.||",,,"no.uia:inspera:148330406:37036963",,"https://hdl.handle.net/11250/3079260","",,"University of Agder",,,,,,,,"Kroppsøvingslæreres refleksjoner rundt bruk av tverrfaglige temaer i friluftslivsundervisningen",,"Master thesis",
"463e4580-461c-47e7-83f0-68747b3c32ce","11250/3034394","Garshol, Lenka","Kolstad, Jonas","2023",,"This thesis aimed to investigate using a commercial off-the-shelf (COTS) game for English vocabulary learning and acquisition in an 8th-grade class in Norway. The study centers around a classroom intervention where an 8th-grade class tried the game Scribblenauts Unlimited along with additional supplemental activities during a double lesson of English. Furthermore, the study examines the same students' attitudes toward digital games inside and outside the classroom and how COTS games can be adapted and used as a tool for ESL learning in Norway. The thesis examines the connection between language learning theories and digital games and how games connect to Norway's new English curriculum (ENG01-04). A mixed methods approach was used to gather data to address the three research questions. The data includes an online survey with 21 respondents, five semi-structured interviews with ten students, field notes from the classroom, and screen recordings from the class playing Scribblenauts Unlimited. The results from the research show that the game Scribblenauts Unlimited can contribute to vocabulary learning, that most students play video games in their spare time, and that they were also optimistic about games as a tool for English learning at school. In addition, the results also show that COTS games, which are games made for entertainment, are motivational tools and can facilitate English learning in the classroom. The goal of this thesis was to show the possibilities of using digital games in the classroom and that the teacher can adapt COTS games for English learning in the classroom. Additionally, the research will build on existing research in the field and show other teachers that gaming is a teaching method worth trying with their classes.||",,,"no.uia:inspera:143763411:37042745",,"https://hdl.handle.net/11250/3076241","",,"University of Agder",,,,,,,,"Commercial-off-the-shelf games in the English classroom: Adapting a COTS game as a language learning tool for English language learning in an 8th-grade class.",,"Master thesis",
"47406a9e-4499-44b6-a0f5-a621e56c7fac","11250/3034394","Jortveit, Maryann","Kråbøl, Elif Kristine||Hoveland, Annette Laurense","2022",,"Tema for oppgaven er omsorgssvikt og relasjoner, og hensikten med denne studien er å undersøke hvordan lærere kan skape en god relasjon til elever som har opplevd omsorgssvikt. Elever som har opplevd omsorgssvikt kan ofte ha behov for ekstra støtte og omsorg, og en god relasjon til disse elevene kan derfor være av stor betydning. Følgende problemstilling er dermed utarbeidet:

Hvordan kan lærere skape en god relasjon til elever som har opplevd omsorgssvikt?

For å svare til problemstillingen er det benyttet en kvalitativ forskningsmetode med et fenomenologisk forskningsperspektiv. Vi har gjennomført semistrukturerte intervjuer av tre lærere med kunnskap og erfaringer på området. Dette fordi lærernes erfaringer, opplevelser og meninger er av stor betydning.

I studiens empiri kommer det frem fire sentrale elementer; lærernes forståelse av omsorgssvikt, relasjonens betydning, lærernes arbeid med relasjonsbygging, og utfordringer. Utfordringer er ikke direkte knyttet til problemstillingen, men lærerne i studien er tydelige på at utfordringer vil oppstå i relasjonsbyggingen. Dermed ble dette også relevant å inkludere.

Omsorgssvikt er et vesentlig begrep i studien, og vi har derfor undersøkt hvordan lærere forstår fenomenet, for å se om det er av betydning når en god relasjon skal skapes. Samtidig har vi utforsket hvilken betydning relasjonen mellom lærer og elev har i arbeidet med elever som har vært utsatt for omsorgssvikt.

I lærernes arbeid med relasjonsbygging til elever som har opplevd omsorgssvikt, kommer det frem fire viktige faktorer. Tålmodighet er en av dem. Lærere kan ofte havne i utfordrende situasjoner i arbeidet med sårbare barn, og i slike tilfeller kommer tålmodighet frem som sentralt å opprettholde. Tid kommer også frem som en nødvendighet, da det for disse elevene kan ta lenger tid å knytte seg til andre. Å skape forutsigbarhet for elevene i deres skolehverdag blir også fremstilt som essensielt, da det kan føre til at elevene opplever større grad av trygghet. En siste faktor er at lærere har et godt samarbeid med alle som er involvert i eleven, både kolleger og foresatte. På den måten kan elevene oppleve en helhetlig hjelp og støtte.||",,,"no.uia:inspera:109909614:72065919",,"https://hdl.handle.net/11250/3036562","",,"University of Agder",,,,,,,,"Omsorgssvikt og relasjonsbygging",,"Master thesis",
"47a36bb7-b33e-45b5-9909-8c8d1b0f552a","11250/3034394","Eriksen, Stig||Candasamy, Thomas Christopher","Edvardsen, Rebecca||Vikhagen, Mari Katrine","2023",,"Algoritmisk tenkning og modellering har fått økt oppmerksomhet i matematikkundervisningen etter innføringen av den nye læreplanen for matematikk i 2020. Dette masterprosjektet har som formål å undersøke hvordan elevers algoritmiske tenkning kommer til uttrykk i en modelleringsprosess med Scratch som verktøy. På
bakgrunn av dette har vi utarbeidet to forskningsspørsmål. Det første undersøker hvilke kjerneferdigheter i algoritmisk tenkning som ofte er sammenfallende med faseovergangene i elevenes modelleringsprosess. Det andre omhandler hvordan algoritmisk tenkning og modelleringsprosessen knyttes sammen i elevenes arbeid.
 
Vår kvalitative casestudie baserer seg på observasjon, samt lyd- og skjermopptak av to elevpar i 10. klasse, som arbeidet med en modelleringsoppgave relatert til personlig økonomi ved hjelp av Scratch som verktøy. Vi utarbeidet oppgaven med ønske om at den skulle oppleves virkelighetsnær og invitere til algoritmisk tenkning.
 
Vi tar utgangspunkt i tematisk analyse som metode for å analysere datamaterialet vårt. For å belyse vår problemstilling og forskningsspørsmål, støtter vi oss på analytiske rammeverk tilknyttet kjerneferdigheter innen algoritmisk tenkning og faseovergangene i modelleringsprosessen. Vi har satt sammen et analytisk rammeverk for algoritmisk tenkning basert på internasjonal forskning. Primært har vi benyttet oss av CompuThink-rapporten fra 2016 og rammeverket til Brennan og Resnick fra 2012. Når det gjelder modelleringsprosessen har vi vi satt sammen et analytisk rammeverk der vi kombiner Blum og Leiß sin modelleringssyklus med Greefrath sin videreutvikling av denne modelleringssyklusen som inkluderer teknologi.

Gjennom vår analyse avdekket vi at kjerneferdighetene abstraksjon, algoritmebehandling og feilsøking innen algoritmisk tenkning ofte er sammenfallende med faseovergangene matematisere, jobbe matematisk og validere i elevenes modelleringsprosess. Videre diskuterer vi hvordan disse knyttes sammen i elevenes arbeid med modelleringsoppgaven.||",,,"no.uia:inspera:143765519:31541462",,"https://hdl.handle.net/11250/3080734","",,"University of Agder",,,,,,,,"Algoritmisk tenkning og matematisk modellering",,"Master thesis",
"4b921ce1-8e47-4acc-9979-6024ec34fa5b","11250/3034394","Eriksen, Stig||Raustøl, Håkon Malvin","Hornnes, Kristoffer André","2023","Full text not available","When the new curriculum (LK20) came out, new tasks on the exam also came out. In mathematics, a new task category was also introduced. It was called task category 3 and it is tasks in this category that I used in my research. Since these were new tasks and there was little research on this subject, I got inspired to find out how the students will solve these tasks. Based on this, I investigated the following: Which processes described in the core elements do the students use when they solve the new exam tasks?

To shed light on this issue, I have used a qualitative method, where I have observed and taken audio recordings of 3 groups of pupils in the 10th grade when they were working on exam papers. I chose to focus on the processes connected to modeling and generalization. I used the theoretical framework from Blum and Leiß (2007) modeling process and Mason (et al., 2010) processes on thinking mathematically as a starting point to describe the processes that were used.

I have found that the students follow these processes from my theoretical framework to a certain extent. In the generalization process, the students mainly use specialization to answer the task and only one of three groups uses generalization to answer the task. In the modeling task, the students go through all the processes, but the students are more at a number level than a presentation level. This means that the students are more concerned with finding an answer rather than creating a mathematical model of the task. 

In this study, one can gain an insight into various processes associated with generalization and modelling, and what challenges students in the 10th grade may have when they face these new exam tasks.||",,,"no.uia:inspera:143765519:20997566",,"https://hdl.handle.net/11250/3074478","",,"University of Agder",,,,,,,,"Nye eksamensoppgaver i matematikk",,"Master thesis",
"4cbbd887-60c0-47e0-8eaf-1777c1f6bacd","11250/3034394","Mustad, Erik","Odland, André||Stensvand, Håkon","2022",,"This thesis is a study of the American immersion pedagogy Reacting to the Past (RTTP) and
how this pedagogy can be used in the Norwegian EFL classroom in lower secondary school.
RTTP is a series of role playing games developed for American colleges and universities.
Our thesis is split into three research questions, examining how to adapt a game for use in
lower secondary school.

Together with two other MA students, we adapted the game Ending the Troubles :
Religion, Nationalism, and the Search for Peace and Democracy in Northern Ireland, 1997-
98, in accordance with the subject curricula, LK20. We played the game in a 10th grade class
over two weeks in January 2022. In RTTP, the pupils run proceedings in the classroom and
the teacher serves as the game master who oversees the process. During each session, we
observed and took notes. At the end of the intervention, a survey was conducted to
investigate which parts of our adaptation had succeeded or failed.

We have played RTTP at university both in Norway and the United States and have
been part of a project working on developing RTTP games. The potential of the pedagogy
was something we wanted to test to see if it could be used in 10th grade classes.

Our study found that it can be an effective learning tool in Norwegian 10th grade
classrooms with some changes in the build-up and preparation of the game. Most of the
pupils in our intervention enjoyed playing the game, saying “it was more fun than traditional
teaching”. Some pupils claimed they learned more from the RTTP game than they normally
would. Our study also justifies the use of RTTP as a learning tool through the competence
aims in LK20.||",,,"no.uia:inspera:107666473:5295746",,"https://hdl.handle.net/11250/3036541","",,"University of Agder",,,,,,,,"Role Play in the Norwegian EFL Classroom: Adapting a Reacting to the Past Game to the Norwegian 10th Grade Classroom in Accordance with the Subject Renewal 2020",,"Master thesis",
"4cdbcf21-b9b7-4c4c-a819-c09132e75dae","11250/3034394","Hadjerrouit, Said","Aghakouchaki, Soroush||Snilsberg, Henrik","2024",,"I denne masteroppgaven presenteres et kvalitativ studie av integreringen av programmering i matematikkundervisningen hos matematikklærere på ungdomstrinnet. Studiens hensikt er å undersøke læreres vektlegging av kunnskaper der programmering ble benyttet som hjelpemiddel i matematikkundervisning. Oppgaven baseres på teori om lærernes teknologiske pedagogiske faginnholdskunnskap (TPACK-rammeverket) og en 5-stegs modell om adaptering av teknologi i klasserommet. Problemstillingen går ut på å undersøke lærernes grunnleggende kunnskaper og integrasjon av programmering ved bruk av TPACK-rammeverket.Vi har  utviklet tre konkrete forskningsspørsmål for å besvare denne problemstillingen:
Hvordan vektlegger lærerne teknologisk-, pedagogisk- og faginnholdskunnskap i arbeidet med programmering i matematikkundervisning på ungdomsskolen?
Hvilke elementer i TPACK rammeverket identifiseres i den påståtte planleggingen og utføringen av undervisning i matematikk med programmering som verktøy i ungdomsskolen?
I hvilken grad utfyller lærerne stegene i Niess et al. (2009) sin 5-stegs modell om integrering av teknologi, spesifikt programmering, i matematikkundervisning på ungdomsskolen? 
For å kunne svare på disse har vi gjennomført et studie hvor vi intervjuet og observerte tre lærere for å høre om deres opplevelser med og tanker om å bruke programmering som hjelpemiddel i matematikkundervisning. Ved bruk av TPACK- rammeverket har vi analysert svar og observasjoner for å finne hvilke elementer av kunnskap lærerne omtaler og bruker i arbeidet.
Resultatene viser til at kunnskap om teknologi, faginnhold og pedagogikk er alle tre viktige faktorer i bruk av programmering i undervisning, der ingen av dem skiller seg spesielt ut. Lærerne vektlegger vanskeligheten av skillet mellom programmering som hjelpemiddel og kompetansemål, samt hvordan dette passer til de forskjellige temaene. Likevel viser alle lærerne at de har adaptert programmering godt inn i undervisningen, og evaluerer stadig virkningen den har på elevene.||",,,"no.uia:inspera:229824458:37673713",,"https://hdl.handle.net/11250/3140996","nob",,"University of Agder",,,,,,,,"Programmering som verktøy i matematikkundervising: En flercasestudie av tre læreres kunnskap om- og adaptasjon av programmering, på bakgrunn av TPACK-rammeverket",,"Master thesis",
"4d1b6245-5f1c-47bd-b132-42c31a779473","11250/3034394","Ketil Østrem og Elling Tufte Bere","Rustad, Lasse","2022","Full text not available","Sammendrag
Friluftsliv er en viktig del av livet til det norske folk. Emnet har fått en sentral plass i skolen og kan enkelt finnes i styringsdokumentene i kroppsøvingsfaget (Utdanningsdirektoratet, 2020, s. 4-8). Formålet med denne studien var å kartlegge i hvilken grad friluftsliv ble undervist i grunnskolen. Friluftsliv er et fag som kan ha mange positive effekter på elevene. De får kunnskap om hvordan ferdes trygt i naturen, fysisk aktivitet, naturopplevelser og et sosialt fellesskap (Jordet, 2017, s. 359-360). Ut fra tidligere forskning på dette område ser man tendenser til at friluftslivsundervisning nedprioriteres i skolen. Denne studien vil se på hvor stor andel av et utvalg klasser som blir eksponert for undervisning i friluftsliv i kroppsøving. Den vil også undersøke om geografiske forskjeller og årstiden man befinner seg i er relevant for eksponeringen av undervisningsformen.

Studien vil undersøke om mengden undervisning i friluftsliv kan gjenspeile den posisjonen friluftsliv har i styringsdokumentene. For å svare på denne problemstillingen er det også formulert to forskningsspørsmål; På hvilken måte har geografisk plassering betydning for mengden friluftsliv som undervises? Hvordan spiller årstidene inn på dette?

For svare på problemstillingen er det valgt å gjøre en kvantitativ studie med et tidsseriedesign. Materialet til studien er hentet fra 10.klasser i Agder og Troms og Finnmark. Til sammen ble det hentet informasjon fra 47 skoler og 109 klasser. Innsamlingsmaterialet som ble hentet fra de forskjellige klassene var ukeplaner/periodeplaner/årsplaner. Etter innsamlingen ble klassene kategorisert etter hvor mye friluftsliv de gjennomførte.

Resultatene fra studien viser at det i perioder er en nedprioritering av friluftsliv i skolen, men graden av hvor mye friluftsliv som undervises varierer utfra geografisk plassering og årstid. Skolene/klassene i Agder praktiserer betydelig mindre friluftslivsundervisning sammenliknet med skolene/klassene i Troms og Finnmark. Studien viser også til en gradvis nedgang av friluftslivsundervisning ettersom man beveger seg fra høst til vinter.

Studien kan konkludere med at den viser en periodevis nedprioritering av friluftsliv i kroppsøvingsfaget som problemstillingen ønsket å undersøke.

Nøkkelord: Friluftsliv, nedprioritering, kroppsøving, grunnskolen, kvantitativ metode, ukeplaner, klasser||",,,"no.uia:inspera:106933773:9792744",,"https://hdl.handle.net/11250/3036594","",,"University of Agder",,,,,,,,"I hvilket omfang praktiseres friluftsliv i kroppsøving",,"Master thesis",
"4d40f058-c71a-4610-8d65-ac8788346ce0","11250/3034394","Haugen, Tommy","Kleven, Sigurd||||Rosseland, Arnold Gulliksen","2022","Full text not available","Formålet med denne studien var for det første å utvikle og utprøve et instrument som skulle måle graden av transformasjonsledelse hos kroppsøvingslærere i deres profesjonsutøvelse. For det andre skulle vi bruke instrumentet til å måle om det var noen gruppeforskjeller i denne sammenhengen. De gruppene vi ønsket å undersøke var kvinnelige og mannlige kroppsøvingslærere,  jenter og gutter i kroppsøvingsfaget og idrettsaktive og ikke idrettsaktive elever. Vi gjennomførte studien på 4 skoler, og det var 161 respondenter som deltok i undersøkelsen. I denne sammenheng svarte 87 respondenter at dem hadde kvinnelig kroppsøvingslærer, og 72 respondenter svarte at dem hadde mannlig kroppsøvingslærer. Det var 74 respondenter som var jenter, og 85 respondenter som var gutter. 89 respondenter svarte at de driver med organisert idrett på fritiden, og 70 svarte at de ikke drev med organisert idrett på fritiden. For å samle inn data brukte vi et instrument som vi videreutviklet fra det originale instrumentet som SEP-HEP hadde utviklet. Kvantitativ metode og bruk av closed-response survey ble brukt til å samle inn data, og IBM SPSS Statistics ble brukt til å analysere dataene vi fikk inn. Vi brukte prinsipal komponent analyse til å finne ut at vår studie viste at transformasjonsledelse består av kun en dimensjon. Vi brukte independent sample t-test til å finne ut at det ikke var noen forskjeller i gruppene vi undersøkte.||",,,"no.uia:inspera:106933773:23019697",,"https://hdl.handle.net/11250/3036587","",,"University of Agder",,,,,,,,"Kroppsøvingslæreren som transformasjonsleder",,"Master thesis",
"4deb8473-3b13-4964-9518-968eeb5c893d","11250/3034394","Eva Mila Lindhardt","Tawfiq, Arian","2023","Full text not available","I denne masteroppgaven har jeg presentert og analysert fremstillingen av hinduismen og islam i to lærebøker etter fagfornyelsen: Store Spørsmål 8-10 og KRLE 8. 

Jeg har valgt å presentere begge religionene med bakgrunn i to analytiske perspektiver. Læreplanen står aktuelt som teori for min oppgave da jeg blant annet ser på hvordan lærebøkene presenterer innholdet av religionene med bakgrunn i kompetansemål og et utvalg av kjerneelementene. Videre har jeg sett på tidligere forskning og teori om lærebøker. 
Dette er forskning som ser på blant annet kritikk av verdensreligionsmodellen, innenfra- og utenfra perspektiver og betydningen av gjenkjennelse og representasjon av de ulike religionene. 
Jeg har brukt en kvalitativ tekstanalyse som metode og denne metoden følger den vitenskapsteoretiske plasseringen som heter hermeneutikk. 

Min oppgave viser hva som kommer frem i presentasjonen av religionene og hva som er fraværende i lys av den tidligere forskningen. En rød tråd jeg ser går igjen i teori og forskning er mangfold, representasjon, gjenkjennelse og beskrivelser av det religiøse hverdagslivet. Mine beskrivelser viser til at bøkene forholder seg litt ulikt i sine presentasjoner i forhold til fagfornyelsen.||",,,"no.uia:inspera:143803085:36790952",,"https://hdl.handle.net/11250/3082527","",,"University of Agder",,,,,,,,"En analyse av lærebøker i KRLE for ungdomstrinnet",,"Master thesis",
"4f27f396-398e-4742-8b7b-fdc7ed4106da","11250/3034394","Erik Mustad","Henriksen, Jan Åge","2024",,"The purpose of this mixed methods study is to analyze how three distinct publishers portray African American history in English Foreign Language (EFL) textbooks for Norwegian lower secondary schools (8th- 10th grade) and how the content aligns with the aims of the current national curriculum (LK20). The previous national curriculum, LK06, contained a competence aim concerning history in the UK and US, which was excluded in the revision to LK20. The purpose is to explore how African American history is presented in EFL textbooks after the exclusion of a history-focused competence aim and how it aligns with LK20.

The competence aims apply to the entire lower secondary school, so the publishers can choose which year to prioritize a given aim. Therefore, the number of analyzed textbooks from each publisher and the grade level they targeted varied. A total of seven textbooks are included in the analysis.

The mixed methods feature a qualitative approach to evaluating the content based on a theoretical background, including semiotics, multimodality, and CRT. In addition, the study utilizes a quantitative approach to measure the frequency of African American history content in the analyzed textbooks to provide further dimension and a more comprehensive analysis. 

The results reveal that the publishers prioritize different aspects of African American history in their respective textbook series. All the publishers cover some aspects, whereas certain publishers entirely exclude others. Despite differences, they all align with the competence aims of LK20. Additionally, the findings revealed an occurrence of attributing African Americans with otherness in one of the textbooks. The implications point to the importance of teachers’ professional judgment when considering the selection of learning material, integrating African American history into their practice, and how educational sources portray people.||",,,"no.uia:inspera:222051179:36692327",,"https://hdl.handle.net/11250/3135083","eng",,"University of Agder",,,,,,,,"Portrayal of African American history in EFL textbooks: A mixed methods study of the representation of African American history in Norwegian lower secondary school EFL textbooks",,"Master thesis",
