id,collection,dc.contributor.author,dc.contributor.editor,dc.date.issued,dc.description.abstract[],dc.description.abstract[en_US],dc.description.localcode[en_US],dc.description[en_US],dc.identifier.uri,dc.language.iso[en_US],dc.publisher[en_US],dc.rights.uri[*],dc.rights[*],dc.subject[en_US],dc.title.alternative[en_US],dc.title[en_US],dc.type[en_US]
"73fd6a2b-c144-4870-a83d-c94cb2d258e2","11250/2473201","Eide-Olsen, Madeleine",,"2024",,"In an increasingly interconnected world, both demographically and digitally, communicating and interacting with people from different backgrounds, with different worldviews and mindsets is inevitable. The need for developing intercultural competence may be more important than ever before, and central to fostering this development is formal education. In this context, the present thesis is written in the field of English didactics and investigates how learning tasks on the Digital Learning Platforms Elevkanalen and Skolestudio might promote Intercultural Learning for Lower Secondary School EFL learners. The present study draws on Byram’s (2020) model for Intercultural Communicative Competence and Deardorff’s (2006) Pyramid model for Intercultural Competence. The design of the learning tasks was analysed in light of Moreno & Mayer’s (2007) five types of Interactivity in Multimodal Learning Environments. Finally, the learning tasks were categorised based on whether they encouraged peer collaboration. 
Through a learning task analysis based on both qualitative and quantitative aspects, the present study found a prevalence of learning tasks linked to the promotion of factual knowledge and a lack of tasks related to critical cultural awareness on both platforms. When examining the digital features of the learning tasks’ design, the present study indicates that few of the tasks on the platforms capitalise on the opportunities afforded by the digital format. The findings also show that learning tasks on both platforms encourage peer collaboration. However, few learning tasks were linked to co-construction of intercultural meaning between peers or the practice of communication in intercultural encounters. A pedagogical implication derived from this study suggests that teachers play an important role in adapting learning tasks to fulfil the curriculum’s comprehensive goals of a holistic and all-round development of learners, including intercultural competencies","MGUEN550","Master i grunnskolelærerutdanning 5. - 10. trinn, engelsk. Høgskulen på Vestlandet, campus Bergen","https://hdl.handle.net/11250/3159844","eng","Høgskulen på Vestlandet","http://creativecommons.org/licenses/by/4.0/deed.no","Navngivelse 4.0 Internasjonal","grunnskolelærerutdanning||engelsk||Elevkanalen||Skolestudio||læringsoppgaver||språkutdanning",,"Investigating Intercultural Competence on Digital Learning Platforms for Lower Secondary School: An Analysis of Learning Tasks","Master thesis"
"cf3e8861-2c68-428a-a140-171171d903b4","11250/2473201","Tuset, Åse Sofie",,"2024",,"The primary focus of this thesis is to examine the potential of graphic novels to promote the principles of justice-oriented citizenship in the English as a Foreign Language (EFL) classroom. The selected graphic novels are When Stars Are Scattered by Omar Mohamed and Victoria Jamieson, Displacement by Kiku Hughes, and Marshmallow & Jordan by Alina Chau. To achieve this, a multimodal analysis method is applied to six selected passages (two from each novel) with a focus on how the novels depict authority figures and oppressive systems. The multimodal analysis focuses on how the visual features of the characters’ gazes, the type and angle of the shot, and the characters’ appearances affect the reading process of the novels and how this can illustrate their potential for working with the principles of justice-oriented citizenship. These principles involve the ability to critically examine established ideas, explore new perspectives, question power, reflect on injustice, and act on those reflections. The findings indicate that graphic novels can provoke questions and reactions in pupils, possibly leading to new insights about society and injustice. 
This study suggests that the selected graphic novels have great potential to enhance pupils' understanding of the world and support the principles of justice-oriented citizenship by giving a voice to youth who experience inequality and oppression through the graphic novels. The findings offer practical insights for middle-grade EFL teachers, aiding them in selecting suitable literature for the classroom with a high potential for insight and helping them choose literature in line with the curriculum.","MGUEN550","Master i grunnskolelærerutdanning 5. -10. trinn, engelsk. Høgskulen på Vestlandet, campus Bergen","https://hdl.handle.net/11250/3159867","eng","Høgskulen på Vestlandet","http://creativecommons.org/licenses/by/4.0/deed.no","Navngivelse 4.0 Internasjonal","grunnskolelærerutdanning||engelsk",,"Shaping a justice-oriented classroom: exploring the potential of graphic novels to foster the principles related to justice-oriented citizenship","Master thesis"
"ea8b1086-1315-49ba-8b51-9383f51dc091","11250/2473194","Opsata, Vemund",,"2024",,"I denne masteren undersøker jeg hva gutter forteller om egne tanker rundt kroppsidealer. Jeg brukte en fenomenologisk tilnærming som retter seg mot deres subjektive opplevelser, men ser også det guttene fortalte i sammenheng med hverandre. Hensikten med studien er å løfte fram og få innsikt i guttenes egne erfaringer og tanker rundt kroppsidealer, som jeg håper kan bidra til å utviklingen av min profesjonsutøvelse rettet mot å fremme positive kroppsideal og forståelse ovenfor gutter. I tillegg ønsket jeg å forstå deres erfaringer, og se deres meninger, rundt kroppsidealer i en kroppsøvingskontekst. 
For å undersøke temaet har jeg utformet forskningsspørsmålene:
I. Hva forteller gutter på 9 – 10. trinn om egne tanker rundt kroppsidealer?
II. Hva trer fram når guttene forteller om kroppsidealer i en
kroppsøvingskontekst? 

For å ha et teoretisk grunnlag for makten bak idealene om kropp, anvendte jeg Foucaults (1926 – 1984) teori om makt. Jeg støttet meg i størst grad til det han forteller om diskurser, men også litt om maktens mikrofysikk. Teorien gidde meg et grunnlag for å nærmere undersøke hvorfor guttene har deres nåværende kroppsidealer. For å produsere empirisk materiale brukte jeg semistrukturert intervju som kvalitativ metode. Intervjuene besto av fem individuelle intervjuer med gutter på 9 – 10. trinn. Etter å ha gått flere år på skolen, samtidig som de befinner seg i en alder der kroppen allerede har utviklet seg og fortsatt er i utvikling, kan dette gi dem et grunnlag for å ha flere erfaringer og refleksjoner om kroppsidealer enn yngre gutter.

Studien belyser hva slags kropp guttene betrakter som den ideale kroppen. Kroppsidealet besto av en atletisk og sunn kropp, der kroppen er godt trent, har markerte muskler, lite kroppsfett og har forholdsvis proporsjonert oppbygging. De fleste guttene var også tydelig på at de ikke ønsket seg for store muskler. Idealene anser de som motiverende og som kroppslige mål for egen trening, men noen av de anerkjenner også at kroppsideal kan for andre oppleves urealistiske og føre til dårlig selvbilde. I studien synliggjøres det hva guttene anser som betydningsfullt for deres nåværende kroppsideal. Interesse for en idrett, framstillinger av kropper i sosiale medier, og innflytelse fra søsken ble synliggjort som makt diskurser for deres idealer. I tillegg framsto det også uttrykk for at språkliggjøringen i vennekretser kan ha betydning for deres kroppsideal. I sammenheng med hva guttene fortalte om kroppsidealer i en kroppsøvingskontekst, framsto det at kroppsøving var en arena der guttene sammenlignet seg selv og sine egne kropper mot andre elever. De erfarer at kroppsidealer som fremmes og favoriseres ikke bare er de atletiske kroppene, men at en større variasjon av kropper verdsettes. Guttene sitter med inntrykk av at de ikke har arbeidet med, eller har arbeidet lite med kroppsidealer i kroppsøvingsundervisningen. Tilsynelatende for å mene at det hadde vært nyttig å arbeide mer med kroppsidealer, er ikke dette ønskelig ettersom de vektlegger kroppsøving som et aktivitets-fag. Samlet sett gir disse funnene et innblikk i hvordan gutter på 9. og 10. trinn forholder seg til og opplever kroppsidealer både i og utenfor skolen, og hvordan ulike faktorer influerer deres idealer. Denne innsikten kan berike min profesjonsutøvelse i møte med elevene.","MGUKØ550",,"https://hdl.handle.net/11250/3159868","nob","Høgskulen på Vestlandet","http://creativecommons.org/licenses/by/4.0/deed.no","Navngivelse 4.0 Internasjonal","Body ideal||physical education||body||physical appearance||boys' ideals||discourses","«I want my body to look strong and fit, and a sixpack too!» - A qualitative study on secondary school boys thoughts regarding body ideals","«Jeg har jo lyst til at kroppen min skal se sterk og fit ut, og sixpack da!» - En kvalitativ studie om ungdomsskolegutters tanker rundt kroppsidealer","Master thesis"
"3f052a66-2899-4769-9b3e-b42c0ec439a0","11250/2473201","Gillow, Katie Lynn",,"2024",,"This thesis focuses on the relationship between language and culture, explicitly exploring African American English (AAE), a dialect within the African American Language (AAL) umbrella. The thesis will examine how AAE is used in Zora Neale Hurston’s short story collection, Hitting a Straight Lick with a Crooked Stick (2020). The central argument of the thesis is that exposing tenth-grade English as a Foreign Language (EFL) students to AAE can serve as a gateway to a deeper understanding of Black history, language, culture, race, and racism, thereby promoting intercultural competence (IC), which is a key component of the Norwegian English curriculum (LK20). To support this argument, the thesis will employ qualitative deductive research methods, including literary dialect analysis and literary analysis. The findings of this research will be used in conjunction with Hild Elisabeth Hoff’s Model of the Intercultural Reader (MIR) to develop strategies for creating intercultural readers","MGUEN550","Master i grunnskolelærerutdanning 5. - 10. trinn, engelsk. Høgskulen på Vestlandet, campus Bergen","https://hdl.handle.net/11250/3159840","eng","Høgskulen på Vestlandet","http://creativecommons.org/licenses/by/4.0/deed.no","Navngivelse 4.0 Internasjonal","grunnskolelærerutdanning||engelsk||språk||kultur",,"Uncovering Intercultural Competence through African American English in Zora Neale Hurston’s Works: The Crooked Stick","Master thesis"
"0e95b604-5639-4318-9fa7-286fa9b3eb43","11250/2473201","Wiggen, Celene",,"2024",,"This thesis focuses on the relationship between literature and hollistic sexual education, particularly exploring literary representations of sexual consent in contemporary, epistolary Young Adult (YA) literature. This thesis will examine how sexual consent is portrayed in Stephen Chbosky’s The Perks of Being a Wallflower (1999) and Jay Asher’s Thirteen Reasons Why (2007). The main argument of the thesis is that literature and its narrative forms can serve as a gateway to a more holistic sexual education in the Norwegian English Foreign Language (EFL) classroom and thereby promote Health and Life Skills, which is one of three interdisciplinary topics in the Norwegian Curriculum (LK20). Through Literary representations of sexual consent can potentially facilitate a deeper understanding of social and heteronormative structures that lead to sexual violence in Norwegian EFL tenth graders. Pupils may also gain a communicative sexuality by exploring how sexual consent is communicated and expressed through different narrator forms. 
To support this argument, the thesis is founded in relevant theories and scholarly research on sexual consent, epistolary, and narrative form. I employ a close reading method for my literary analysis where I compare and discuss the different consent related events in the novels based on the framework in my theory chapter. Based on the relevant theory and my analysis and discussion of the two novels this thesis concludes that sexual education and the development of a communicative sexuality can benefit from literature with a sexual consent narrative. Additionally, I argue that relatable narratives can create a safe place in that pupils can identify and explore their sexuality within a fictional context.","MGUEN550","Master i grunnskolelærerutdanning 5. - 10. trinn, engelsk. Høgskulen på Vestlandet, campus Bergen","https://hdl.handle.net/11250/3159848","eng","Høgskulen på Vestlandet","http://creativecommons.org/licenses/by/4.0/deed.no","Navngivelse 4.0 Internasjonal","grunnskolelærerutdanning||engelsk||seksualitetsundervisning",,"Are They Crossing the Line? Exploring Literary Representations of Sexual Consent","Master thesis"
"53dbd1fa-f9ad-400c-a1d5-1bdc1c277547","11250/2473201","Eriksen, Malin Gaarder",,"2024",,"This thesis embarks on a comprehensive investigation of grammar tasks within four English as a Foreign Language (EFL) learning materials for primary school year 7. The empirical data are derived from the workbooks Engelsk, Explore, Link, and Quest, and the digital learning universe is Salaby. The study meticulously explores the methodological approaches offered in grammar tasks and the extent to which these tasks align with the latest research on second language acquisition (SLA) and language pedagogy. The results of the textbook analysis provide an overview of the state of grammar in the books and the extent to which the learning material facilitates meaningful and contextualized learning. 
Although the teacher is the most significant factor in instructional methods, teaching materials play a big part in Norwegian classrooms. The sample materials were chosen on the basis that they are updated according to The National Curriculum for the Knowledge Promotion 2020 and are thus available for use in the classroom. The number of grammar tasks counted to determine the place of grammar holds in the materials. Based on established typologies, heavily inspired by Vold (2020), the analytical framework investigates whether the tasks are input or production-based and whether they follow inductive or deductive approaches. The framework helps illustrate the range of activities in these books. 
The findings show that there are some variations within the learning materials. Some provide more varied methodologies, while the role of the teacher becomes more important in others. Within the analyzed material, there still seems to be a tendency to follow traditional approaches to grammar learning and teaching, but contextualization is somewhat represented. Based on the findings, the teacher still needs to add supplementary material for the teaching to be in accordance with current research-based principles for grammar teaching","MGUEN550","Master i grunnskolelærerutdanning 5. - 10. trinn, engelsk. Høgskulen på Vestlandet, campus Bergen","https://hdl.handle.net/11250/3159886","eng","Høgskulen på Vestlandet","http://creativecommons.org/licenses/by/4.0/deed.no","Navngivelse 4.0 Internasjonal","grunnskolelærerutdanning||engelsk",,"Current approaches to grammar teaching: A textbook analysis of Norwegian EFL learning materials in a communicative school context","Master thesis"
"f2c97af1-0ffb-483d-8ab0-26e6b0ebf00e","11250/2473194","Førde, Malin Isane",,"2024",,"Denne masteroppgåva er eit autoetnografisk forskingsprosjekt om kjensler som oppstår hjå kroppsøvingslæraren. Til tross for avgrensa forsking på dette området, tek oppgåva sikte på å identifisere dei kjenslene kroppsøvingslæraren opplev i yrkesutøvinga og setje desse kjenslene på dagsorden. Forskingsspørsmålet for oppgåva er: Kva kjensler identifiserar eg i eigne tekstar om yrkesutøvinga som kroppsøvingslærar?

Forskingsprosjektet tek utgangspunkt i eit fenomenologisk perspektiv, og Thomas Fuchs sine omgrep om interaffektiv, kroppslege resonansar og interaffektive minner. Det inneber at kjensler blir forstått som sosiale, kontekstuelle og kroppsleggjorte, og at dei oppstår i eit samspel mellom lærar og elev. Det empiriske materialet er produsert gjennom refleksjonsnotat som er skrive i tilknyting til undervising og situasjonar i yrkesutøvinga. 

Funna i oppgåva viser eit breidt spekter av kjensler kroppsøvingslæraren kjenner på gjennom ulike situasjonar knytt til lærarutøvinga. Eit døme på kjensler læraren identifiserte i eigne refleksjonsnotat var; glede, mislukkast, mestringskjensle, lei og lykke. Funna viser både kroppslege resonansar og interaffeksjon, men også ein kunnskap om kjensler som er med på å forme undervisning og lærarutøving. Det kjem også fram ein kompleksitet knytt til læraryrket, der læraren har utfordringar med å legge frå seg kjensler og tankar knytt til lærarutøvinga på jobb. Gjennom prosjektet får ein innblikk i ulike kjensler som vert identifisert hjå læraren, medan ein hovudessens som går igjen frå lærarens personlege bakgrunn og funn, er ei glede knytt til å skape rørsleglede hjå elevar. Dette idealet gjennomsyrar lærarens tankar og kjensler knytt til lærarprofesjonen.","MGUKØ550",,"https://hdl.handle.net/11250/3159858","nno","Høgskulen på Vestlandet","http://creativecommons.org/licenses/by/4.0/deed.no","Navngivelse 4.0 Internasjonal","Autoethnography||phenomenology||physical education||emotions||experience||physical education teacher||interaffectivity||teaching profession","Emotional power - an autoethnographic study on a physical education teacher student`s emotions in professional practice","Kjenslekraft - ein autoetnografisk studie om ein kroppsøvingslærarstudent sine kjensler i yrkesutøving","Master thesis"
"3e19ebc9-ff06-47c6-abe3-edcebf1c2578","11250/2473201","Moss, Christel",,"2024",,"The purpose of this thesis is to study the representations of sexualities in Norwegian EFL textbooks. Through studying the representation of sexualities, this study sets out to explore the potential quantitative and qualitative differences between queer sexuality representations and heterosexual representation. The reasoning behind analyzing the potential differences between the representations of sexualities is to see the potential heteronormative tendencies or discourses within Norwegian EFL textbooks, as well as explore the types and amounts of sexual representations existing within the textbooks. Based on the Norwegian national curriculum (LK20), topics such as identity, ways of living, diversity, and inclusion should be found in educational materials; these are topics in which queer representation could be
included or focused on. This study seeks to understand how different textbooks include these topics and if queer representation is included in the discussions. Additionally, there is a focus on which textbooks and which of the included target grades contain the most queer representations and how this representation is portrayed, both textually and visually. Understanding the manners in which queer individuals or topics are represented in textbooks compared to heterosexual individuals or topics could support an understanding of teaching materials and create a more critical view of what they include. The results of this thesis could further improve educators' awareness and critical thinking, as well as shed light on the potential effects limited representations could have on pupils.","MGUEN550","Master i grunnskolelærerutdanning 5. - 10. trinn, engelsk. Høgskulen på Vestlandet, campus Bergen","https://hdl.handle.net/11250/3159854","eng","Høgskulen på Vestlandet","http://creativecommons.org/licenses/by/4.0/deed.no","Navngivelse 4.0 Internasjonal","grunnskolelærerutdanning||engelsk",,"Queer inclusion or queer exclusion?: A study of the representations of sexualities in Norwegian EFL textbooks in relation to heteronormativity","Master thesis"
"8aaf412f-fa63-4a83-9fff-0387d4f643f8","11250/152233","Skare, Janne",,"2024",,"Denne masteroppgaven har som formål å øke bevissthet rundt elever med høyt læringspotensial og deres læringsbehov. For dette har jeg valgt følgende problemstilling: Hvordan opplever ungdomsskoleelever, med høyt læringspotensial i matematikk, at ordinær matematikkopplæring og et nasjonalt forseringstilbud ivaretar deres læringsbehov? For å besvare problemstillingen har jeg benyttet to kvalitative metoder for å samle empiri. Elevene som er informanter ble først invitert til å skrive et notat om sine opplevelser. Dette metodevalget ble gjort for å få fram elevens egen stemme og deres vektlegging av læringsbehov. Deretter ble det gjennomført et semistrukturert intervju med hver av elevene. I intervjuet ble elevens notat brukt som utgangspunkt for samtalen, formålet var å gå i dybden av opplevelsene elevene valgte å trekke fram, i tillegg til å undersøke de læringsbehovene elevene ikke omtalte i sitt notat. Oppgavens data er basert på tre elevers skriftlige og muntlige gjengivelser fra sin matematikkopplæring gjennom grunnskolen, og refleksjonene de har rundt disse. Elevene gikk 10.trinn ved samme ungdomsskole da empiriinnsamlingen tok sted. Datamaterialet ble analysert fenomenologisk, og resultatene blir presentert med ord og modeller i form av diagrammer. Det teoretiske rammeverket mitt består av teori fra Deci og Ryan, Renzulli, Mönks og Ypenburg. Av resultatene fra analysen og det teoretiske rammeverket utformet jeg analytiske spørsmål som jeg diskuterer i kapittel 5. Opplæringsloven skal sikre at også elever med høyt læringspotensial skal få en opplæring som er tilpasset deres læringsbehov. Resultater fra prøver, som PISA og TIMMS, og studier fra blant annet Smedsrud (2018a), Skogen (2014) og Opsahl og Damsgård (2016) viser at norsk skole ikke lykkes med dette. Funn fra denne studien underbygger at elever med høyt læringspotensial ikke får en opplæring som ivaretar deres læringsbehov. Dette er et komplekst problem ettersom hver av elevene er unike og har ulik vektlegging av sine læringsbehov. Denne studien viser hvordan elevene i stor grad skiller seg i sine beskrivelser. Til tross for ulik vektlegging har alle tre et ønske om å bli møtt på sin kompetanse, å få en matematikkopplæring som utfordrer dem slik at de opplever å lære. Et av mine funn er at det nasjonale forseringstiltaket gjennom Digilær.no dekker dette kompetansebehovet. MDIP 550 Kandidatnummer 513 12.05.24 4 I den ordinære matematikkopplæringen, derimot, rapporterer elevene om en undervisning som oppleves lite meningsfull for dem. De melder om lav grad av autonomi og en ytre regulert motivasjon for sin matematikkopplæring. Elevene selv foreslår at nivådeling kan være en godt differensieringstiltak for å imøtekomme deres kompetansebehov. De foreslår videre berikelsestiltak der de får et rikere utvalg oppgaver. De ønsker oppgaver som beriker dem enten med å være innenfor et pensum som er høyere opp i trinn, eller at de får problemløsningsoppgaver som krever at de må være kreative. Det er verdt å merke seg at elevene er ikke spesielt kravstore. Det er små grep de foreslår, som kan gjennomføres innenfor den ordinære opplæringen. Alle tre elevene beskriver at relasjoner og anerkjennelse er viktig for deres opplæring. Det er ikke uventet, men det er interessant at for en av informantene virker relasjoner å ha en mer sentral rolle. For denne eleven virker det som om det trengs et personlig preg der eleven vil oppleve at hun kjenner læreren og medelevene sine, og dermed få trygghet nok til å utfordre seg kognitivt og være kreativ. Det kan virke som at eleven trenger trygge relasjoner for å ha tro på egne evner. De to andre informantene signaliserer at relasjoner og følelse av anerkjennelse er tilstrekkelig hvis de får kognitive utfordringer i sin matematikkopplæring, og en oppfølging av disse. De to uttrykker en indre trygghet på egne evner. Relasjoner virker i tillegg sterkt inn på motivasjonen for opplæring hos alle tre. Når elevene opplever at læreren ikke gir dem anerkjennelse melder de om lav motivasjon. Konklusjonen i studien min er at både elevens kompetansebehov og relasjonsbehov må dekkes for å ivareta deres opplæring. Læreren må bli kjent med eleven og kartlegge læringsbehovene eleven har. Ved at lærer viser interesse og støtte kan elevens følelse av autonomi og relasjonell anerkjennelse forsterkes. Fra mine tre informanter kan det tyde på at kompetansebehovet står sterkest for to av dem og relasjonsbehovet sterkest for en av dem. Funnene mine samsvarer godt med NOU (Jøsendalsutvalget, 2016) sin konklusjon; Elevene trenger å bli identifisert, for å føle seg sett, de trenger differensiering for å få dekket sitt kompetansebehov og de trenger anerkjennelse for å være trygg i sine relasjoner","MDIP550","Master i didaktiske praksiser. Høgskulen på Vestlandet, campus Bergen","https://hdl.handle.net/11250/3149766","nob","Høgskulen på Vestlandet","http://creativecommons.org/licenses/by/4.0/deed.no","Navngivelse 4.0 Internasjonal","didaktikk||matematikk||læringspotensial","A qualitative study of how three students,  defined as having high learning potential in mathematics,  experience that mathematics education attends to their learning needs","En kvalitativ studie om hvordan tre elever,  definert til å ha høyt læringspotensial i matematikk,  opplever at matematikkopplæring ivaretar deres læringsbehov","Master thesis"
