id,collection,dc.contributor.author,dc.contributor.editor,dc.date.issued,dc.description.abstract[],dc.description.abstract[en_US],dc.description.localcode[en_US],dc.description[en_US],dc.identifier.uri,dc.language.iso[en_US],dc.publisher[en_US],dc.rights.uri[*],dc.rights[*],dc.subject[en_US],dc.title.alternative[en_US],dc.title[en_US],dc.type[en_US]
"3d6b60bb-44f1-49c0-a7bb-0028a5de2650","11250/152233","Hjartåker, Kristin",,"2024",,"I denne masteroppgaven studerer jeg hvordan vi skal undervise om Holocaust. Jeg har gjort en gjennomgang av didaktisk teori rundt hva som er formålet med Holocaustundervisningen, hvor jeg fant uenigheter i den didaktiske teoridebatten. Læreplanen erklærer at Holocaust som historisk hendelse kan danne grunnlag for nåtidige perspektiv – for å kunne forebygge ekstreme holdninger og handlinger. Demokrati og medborgerskap har en fremtredende rolle i læreplanen, og blir viktig for denne oppgaven. Skal Holocaust undervises som en historisk hendelse, eller skal Holocaust undervises med mål om å danne demokratiske medborgere? Debatten om Holocaustundervisningen er også del av en større debatt om historiefagets rolle og plass i skolen. 
I lys av den didaktiske teorien og læreplanen som har blitt presentert i oppgaven, har jeg gjort en analyse av et utvalg digitale undervisningsopplegg. De kan gi et innblikk i hvordan folkemordet blir undervist i den norske skole. 
Den didaktiske teorien jeg har funnet peker på store uenigheter rundt hvordan vi skal undervise om Holocaust. På den ene siden er det de didaktikerne som hevder at det må undervises for å kunne forebygge fremtidige hendelser – ved å danne antirasister og demokratiske medborgere. På den andre siden er det de didaktikerne som argumenterer for at Holocaust må undervises som en historisk hendelse, uten å koble fortid til nåtid. Mellom de ytterpunktene av perspektiv har også konseptet historisk empati dukket frem, som ble viktig i analysen av de digitale undervisningsressursene. 
De digitale undervisningsoppleggene viser betydelige forskjeller i hvordan vi skal undervise om Holocaust. Noen av dem er uten historisk empiri, og handler mest om det affektive og emosjonelle hos elevene. Andre inkluderer de tre dimensjonene for historisk empati, noe jeg konkluderer med at er en mer hensiktsmessig måte å skulle undervise om Holocaust og historie på.","MGUSA550","Master i grunnskolelærerutdanning 5. - 10. trinn, samfunnsfag. Høgskulen på Vestlandet","https://hdl.handle.net/11250/3154402","nob","Høgskulen på Vestlandet","http://creativecommons.org/licenses/by/4.0/deed.no","Navngivelse 4.0 Internasjonal","grunnskolelærerutdanning||samfunnsfag||Holocaust||Holocaustundervisning","How should we teach about the Holocaust? A critical analysis of digital learning resources","Hvordan skal vi undervise om Holocaust? En kritisk analyse av digitale undervisningsopplegg","Master thesis"
"21120746-e1ef-40a7-9dcf-4413314dcede","11250/152233","Holm, Hedda Gjelsvik",,"2024",,"Denne studien undersøker hvordan et utvalg lærere forholder seg til utfordringer knyttet til rasisme. Det er benyttet en kvalitativ metode i studien, og det empiriske datamaterialet er hentet inn gjennom intervju med seks lærere, fra Bergen og omegn. 
Analysen er delt opp i fem hovedtema, som representerer forhold som de utvalgte lærerne trakk frem som spesielt utfordrende. Hovedtemaene tar for seg hvordan lærerne underviser om rasisme, hvorvidt de tilpasser undervisningen på grunn av økende bevissthet omkring rasisme blant elevene, elevers anklager av lærere for rasisme, lærernes og elevenes holdninger til bruk av ordet «neger» og elevenes språkbruk i det sosiale samspillet. I intervjuene reflekterer lærerne over problemstillinger knyttet til disse temaene, og deler konkrete opplevelser og erfaringer de har, som er relevante sett opp mot problemstillingen. For å analysere svarene blir det benyttet relevante begreper og teorier som presenteres i teorikapittelet. 
Funnene i studien viser at temaet rasisme oftest blir undervist om som noe historisk, og at lærerne i ulik grad tilpasser sin undervisning på grunn av frykten for den økende bevisstheten/oppmerksomheten omkring rasisme blant elevene. I intervjumaterialet kommer det frem at noen av lærerne har blitt anklaget for å være rasist, og andre ikke, og svarene viser store variasjoner i hvorvidt ordet «neger» kan brukes i undervisning eller ikke. Det empiriske materialet viser at elevene bruker «skjellsord» (men, som vi skal se nedenfor, på ulike måter som ikke alltid er ment for å såre) mot hverandre i skolehverdagen, og at lærerne i ulik grad reagerer på utsagnene. Der noen av dem reagerer på alt de synes man ikke skal si, ser andre an sin relasjon til eleven og elevenes relasjon til hverandre, før de bestemmer om de skal reagere eller ikke. Funnene indikerer videre at lærerne til tider står overfor utfordrende prioriteringer med hensyn til tidsbruk, da yrket også innebærer krav til hva elevene skal oppnå av kunnskap. Som en konsekvens av dette kan lærerne oppleve begrensende muligheter til å reflektere i samråd med elevene, etter utfordrende situasjoner. 
Funnene tyder på at mange av situasjonene lærerne står ovenfor er sosialt komplekse, og at det ofte er mange aktører, relasjoner og hensyn involvert. Dette fører til at hver enkelt situasjon nødvendigvis trenger individuell vurdering, og lærerne må derfor bruke sitt profesjonelle skjønn for å finne den beste løsningen på disse situasjonene","MGUSA550","Master i grunnskolelærerutdanning 5. - 10. trinn, samfunnsfag. Høgskulen på Vestlandet","https://hdl.handle.net/11250/3154406","nob","Høgskulen på Vestlandet","http://creativecommons.org/licenses/by/4.0/deed.no","Navngivelse 4.0 Internasjonal","grunnskolelærerutdanning||samfunnsfag||rasisme","The complex nature of racism: How teachers handle challenges related to racism in schools","Rasismens komplekse natur: Læreres håndtering av utfordringer knyttet til rasisme i skolen","Master thesis"
"49eb0fc0-b871-4eb9-862e-f232e4543676","11250/285933","Børnes, Solveig",,"2024",,"Det tverrfaglige temaet folkehelse og livsmestring er et relativt nytt tema i skolen, som ble innført i Læreplanverket for Kunnskapsløftet 2020 (Kunnskapsdepartementet, 2019). Målet med det tverrfaglige temaet er å integrere kunnskap og ferdigheter knyttet til både fysisk og psykisk helse i undervisningen. På grunn av den relativt korte tiden siden implementeringen av LK20, finnes det begrenset kunnskap om hvordan temaet blir jobbet med i skolen, og i musikkfaget. Hensikten med denne studien er å få innblikk i hvordan dette temaet blir forstått
av musikklærere og jobbet med i musikkfaget. Jeg har derfor hatt følgende problemstilling for studien: 
Hvordan forholder tre musikklærere seg til det tverrfaglige temaet folkehelse og
livsmestring, og hva kan dette fortelle oss om temaets muligheter og utfordringer i
musikkfaget?
For å få svar på dette spørsmålet har jeg hatt et fokusgruppeintervju med tre musikklærere på mellomtrinnet. Studien er plassert i en hermeneutisk vitenskapstradisjon og forskningsprosessen har vært abduktiv der noe teori relatert til temaet var utgangspunkt for intervjuet, mens annen teori ble lagt til etter hvert som jeg så hvilke temaer informantene tok opp. Dermed har teorigrunnlaget i oppgaven vært eklektisk. Det teoretiske rammeverket bygger hovedsakelig på Banduras begrep self-efficacy og hans tenkning om endring i skole og samfunn, selvbestemmelsesteorien av Ryan og Deci, elementer fra Vygotskijs og Bruners
sosiale læringsteori, så vel som Lave og Wengers teori om community of practice, og teori om ledelse fra Lillejord. Fra det musikkpedagogiske feltet har jeg brukt Kennys begrep om community of musical practices, den musikalske erfaringens egenverdi av Varkøy, og Christophersens refleksjoner om samfunnsendringenes implikasjoner for musikkopplæring. Intervjuet har blitt analysert tematisk og viser at musikklærerne anser innføringen av folkehelse og livsmestring som et positivt tiltak og opplever at musikkfaget har særlig mye å bidra med innen dette temaet. Musikkundervisningen blir fremhevet som en arena hvor elevene kan få utfolde sitt engasjement og sine initiativ, hvilket ofte resulterer i mestringsopplevelser. Studien belyser informantenes oppfattelse av musikkfagets egenart, og fokuserer særlig på verdien som ligger i potensialet for fellesskap i musikkundervisningen. Samtidig opplever musikklærne at de fortsatt ikke er kommet så langt i implementeringen av folkehelse og livsmestring, og trekker frem skoleledelsen og kollegialt samarbeid som viktige faktorer i denne sammenheng. Videre poengteres det at temaet er viktig i møte med endringene lærerne observerer blant barn og unge som handler om deres fysiske og psykiske
helse. De bemerker også endringer i foreldregruppen som påvirker skole-hjem samarbeidet. Disse utfordringene blir diskutert i lys av teori og tidligere forskning. Funnene fra studien viser hvilket potensial musikkfaget har for å bidra til folkehelse og livsmestring. De adresserte endringene i elevmassen og foreldregruppen viser at folkehelse og livsmestring har kommet inn på et tidspunkt der det ser ut til å være behov for å jobbe med dette i skolen","MGUMU550","Master i grunnskolelærerutdanning 5. - 10. trinn, musikk. Høgskulen på Vestlandet, campus Bergen","https://hdl.handle.net/11250/3154867","nob","Høgskulen på Vestlandet","http://creativecommons.org/licenses/by/4.0/deed.no","Navngivelse 4.0 Internasjonal","grunnskolelærerutdanning||musikk||musikkundervisning||folkehelse||livsmestring","It leaves a mark that other disciplines cannot achieve: A study on teachers' perceptions of health and life skills in music education","Det setter et avtrykk som andre fag ikke kan gjøre: en studie av læreres oppfatninger av folkehelse og livsmestring i musikkundervisning","Master thesis"
"8473e9ed-2ec5-4370-af80-906b11cf955a","11250/285933","Andersen, Lisa",,"2024",,"I denne masteroppgaven har jeg utforsket nyutdannede musikklæreres profesjonsidentitet. Mitt mål har vært å identifisere deres verdier og syn på profesjonen og musikkfaget, samt deres kunnskapssyn og holdninger til utvikling og kollegialt samarbeid. Bakgrunnen for studien springer ut av ønsket om å undersøke hvordan grunnskolelærerstudiet forbereder lærerstudenter til yrkesutøvelse, og i hvilken grad nyutdannede lærere er bevisste sin rolle og identitet som profesjonelle. Studien har følgende problemstilling: 
Hva kjennetegner tre nyutdannede musikklæreres profesjonsidentitet? 
Jeg intervjuet tre nyutdannede grunnskolelærere med musikk som masterfag, alle uteksaminert i 2022 og med ett års arbeidserfaring som lærere på intervjutidspunktet. Intervjuene var semistrukturerte enkeltintervjuer, og resultatene ble analysert ved tematisk analyse. Min tilnærming til analysen var hermeneutisk, og det innebar en kontinuerlig veksling mellom teori og empiri gjennom abduksjon. I diskusjonen av resultatene benyttet jeg Aristoteles’ kunnskapsdimensjoner, ulike fagsyn og legitimeringsargumenter, samt grunnleggende profesjonsteori. 
Mine funn indikerer at musikklæreres profesjonsidentitet er sterkt preget av en elevorientering. De ser på musikkfaget som et trivselsfag og vektlegger relasjonsbygging som en viktig ferdighet for lærere. Alle informanter er tydelige på at de føler seg trygge i sin lærerrolle på grunn av sin musikkbakgrunn. De understreker også betydningen av kollegialt samarbeid på skolen for å kunne utvikle sin profesjon videre. 
Til tross for begrenset arbeidserfaring som lærere, har informantene klare synspunkter på musikkfaget og verdsetter relasjonen med elevene. Deres trivsel i jobben og vektleggingen av musikkfagets betydning peker på verdifulle aspekter å bygge på for lærerutdanningen. Økt fokus på disse verdiene kan være en strategi for å øke trivselen blant nyutdannede musikklærere og styrke musikkfagets posisjon i skolen. Videre forskning bør inkludere flere informanter for å få et mer helhetlig bilde av den profesjonelle identiteten til nyutdannede musikklærere, samt utforske perspektivet til mer erfarne lærere","MGUMU550","Master i grunnskolelærerutdanning 5. - 10. trinn, musikk. Høgskulen på Vestlandet, campus Bergen","https://hdl.handle.net/11250/3154859","nob","Høgskulen på Vestlandet","http://creativecommons.org/licenses/by/4.0/deed.no","Navngivelse 4.0 Internasjonal","grunnskolelærerutdanning||musikk||musikkfaget","To be a professional teacher, the most important thing is, in a way, the students: A qualitative interview study on the professional identity of novice music teachers","For å være en profesjonell lærer, så er, på en måte, det viktigste elevene: En kvalitativ intervjustudie av nyutdannede musikklæreres profesjonsidentitet","Master thesis"
"7f255de4-d59c-451d-986b-10b417374a56","11250/285933","Godal, Lars Andreas",,"2024",,"Arbeidet med dette aksjonsforskningsprosjektet har hatt et todelt formål; for det første å undersøke hvordan man kan arbeide med lyttemetodikk i en norsk grunnskole. For det andre å studere hvordan et aksjonsforskningsprosjekt i liten skala kan fungere som målrettet utviklingsarbeid som en del av grunnskolelærerutdanningen. Følgende problemstilling ble laget for å belyse dette:
Hvordan kan man som musikk lærer på mellomtrinnet arbeide med elevenes lyttekompetansei møte med ukjent musikk?
Datainnsamlingen tok form som et aksjonsforskningsprosjekt, hvor jeg underviste to
elevgrupper fra samme klasse over fire uker, med tre økter hver. Den første gruppen hadde sin første økt i uke 1, og den andre gruppen gjennomførte en modifisert versjon av denne økten i uke 2. Samtidig hadde den første gruppen sin andre økt i uke 2, og denne sekvensen fortsatte slik gjennom uke 3 og 4.
Som utgangspunkt for undervisningsøkten brukte jeg Magne Espelands lyttemetodikk, men modifiserte hans undervisningsopplegg for å passe de rammene jeg underviste innenfor. Undervisningsoppleggene jeg benyttet har inneholdt musikk som ikke nødvendigvis er kjent for elevene, på denne måten har jeg fått anledning til å se hvordan elevene møter ukjent musikk, og hvilke assosiasjoner denne musikken bringer frem hos dem. Gjennom dette prosjektet har jeg vist at aksjonsforskning som utviklingsarbeid underveis i en lærerutdanning kan være et nyttig redskap for å synliggjøre sammenhengen mellom teori og praksis. Jeg har demonstrert at det er mulig å integrere arbeid med lyttemetodikk i musikkundervisningen, til tross for et begrenset antall musikktimer og et bredt spekter av mål og innhold som læreplanen stiller. Ved å analysere og drøfte mine feltdata har jeg vist at det er mulig å arbeide målrettet med å utvikle lyttekompetanse. Jeg har også tatt for meg en rekke didaktiske perspektiver som gjør seg gjeldende i et slikt arbeid. Denne oppgaven tar også for seg aksjonsforskning som et redskap for læring både som en del av lærerutdanningen og som utviklingsarbeid i skolen. Jeg har vist at aksjonsforskning kan være et både nyttig og tilgjengelig redskap for læring","MGUMU550","Master i grunnskolelærerutdanning 5. - 10. trinn, musikk","https://hdl.handle.net/11250/3154876","nob","Høgskulen på Vestlandet","http://creativecommons.org/licenses/by/4.0/deed.no","Navngivelse 4.0 Internasjonal","grunnskolelærerutdanning||musikk||lyttemetodikk","Spaces for listening? An action research study on listening in middle school music education","Rom for lytting?  En aksjonsforsknings studie om lytting i musikkfaget på mellomtrinnet","Master thesis"
"e8bd2a7f-7316-4da3-9ce9-a84e7f605c10","11250/152233","Kristiansen, Kamilla Hovdenes",,"2024",,"Ufrivillig skolefravær kan være utfordrende å forstå. Årsaksforklaringer bak problematikken kan være sammensatte og komplekse. Konsekvensene av skolefravær rammer både individet, familien og samfunnet. For å kunne finne eventuelle forslag til løsninger, må man forstå noe om hvorfor elever som i utgangspunktet ønsker å gå på skolen, ender opp med å sitte hjemme. Jeg utforsker problematikken fra et perspektiv som setter individers mangfoldighet og menneskeverd i sentrum. For å belyse dette, benytter jeg problemstillingen: Hvordan kan vi forstå ufrivillig skolefravær i lys av kapabilitetstilnærmingen? 
Studien har en kvalitativ tilnærming, hvor datamaterialet består av eksisterende forskning og litteratur på feltet om ufrivillig skolefravær. Kapabilitetstilnærmingen utgjør også i seg selv en del av dataene, gjennom konseptene og prinsippene av individuell frihet, kapabiliteter og fungeringer. 
Funnene i studien viser at forskning primært belyser psykologiske årsaker bak ufrivillig skolefravær. Forståelsen av psykologiske årsaksforklaringer kan knyttes til en hedonistisk tilnærming til livskvalitet. Både individuelle, sosiale og skolerelaterte årsaksforklaringer bak en elevs skolefravær, skisserer et bilde av et liv med lav livskvalitet. Sett i lys av kapabilitetstilnærmingen, hvor eudaimonisk livskvalitet er av primær moralsk betydning, finner studien at dagens konkurranseskole kan hindre elevers muligheter til å leve liv de verdsetter. Skolens ressurser i seg selv er uten betydning, dersom elevene ikke klarer å nyttiggjøre seg av de. Individets potensial til fungering, forstått som hver enkelt sin konverteringsprofil og kapabilitetssett, kan belyse hvordan skolen ikke nødvendigvis er tilpasset alle elevers forutsetninger. Dette skaper en skole som eleven nødvendigvis ikke har grunn til å verdsette, og ufrivillig skolefravær kan i lys av kapabilitetstilnærmingen forståes som en adaptert preferanse. Oppsummert viser studien at skolen på systemnivå må evaluere hvordan utdanningssystemet fungere i dag, i forhold til skolens formål og sosial rettferdighet.","MGUSP550","Master i grunnskolelærerutdanning 5. - 10. trinn, spesialpedagogikk. Høgskulen på Vestlandet, campus Bergen","https://hdl.handle.net/11250/3154508","nob","Høgskulen på Vestlandet","http://creativecommons.org/licenses/by/4.0/deed.no","Navngivelse 4.0 Internasjonal","grunnskolelærerutdanning||spesialpedagogikk||skolefravær","School refusal: A Qualitative Study in Light of the Capability Approach","Ufrivillig skolefravær: En kvalitativ studie i lys av kapabilitetstilnærmingen","Master thesis"
"76efe9c6-77dc-4067-a138-a51802a940e2","11250/152233","Storås, Camilla Halland",,"2024",,"Denne masteroppgaven har hatt som mål å undersøke bruken av kart i lærebøker i faget samfunnsfag på ungdomstrinnet. De ni lærebøkene som er undersøkt tilhører tre ulike læreverk utgitt for Kunnskapsløftet 2020. Oppgavens overordnede problemstilling er «Hvordan blir kart brukt i lærebøker for LK20 i samfunnsfag på ungdomstrinnet?». På bakgrunn av den ganske åpne problemstillingen har jeg utformet flere forskningsspørsmål, som besvares ved hjelp av både en kvantitativ og en kvalitativ innholdsanalyse. Forskningsspørsmålene handler blant annet om omfanget og andre egenskaper ved kartene, både målbare, kvantifiserbare egenskaper, og andre egenskaper som symbolbruk og fargebruk. 
Funnene viser at omfanget av kart i lærebøkene har hatt en nedgang fra tidligere undersøkelser, samtidig som kartene som blir brukt i hovedsak er presist utformet og har en logisk symbolbruk","MGUSA550","Master i grunnskolelærerutdanning 5. - 10. trinn, samfunnsfag. Høgskulen på Vestlandet","https://hdl.handle.net/11250/3154419","nob","Høgskulen på Vestlandet","http://creativecommons.org/licenses/by/4.0/deed.no","Navngivelse 4.0 Internasjonal","grunnskolelærerutdanning||samfunnsfag||kart","Maps in social science books in LK20: A quantitative and qualitative content analysis","Kart i samfunnsfagbøker i LK20: En kvantitativ og kvalitativ innholdsanalyse","Master thesis"
"20876b79-7a24-4fa3-8f01-9f1c3bbcc845","11250/152233","Kumaranayagam, Keerthan",,"2024",,"Tittel: Digitalisering i skolen – en forskyvning av didaktiske ideer. 
Hensikt: Å undersøke hvordan digitaliseringen i norske skoler har endret undervisningen og hvilke innvirkninger dette har medført på ideene knyttet til didaktikken. 
Problemstilling: «Hvordan har digitaliseringen av skolen påvirket ideer knyttet til didaktikken?» 
Metode: Systematisk litteraturstudie av fagbøker, forskningsartikler og læreplaner med hensyn på digitaliseringen i skolen. Databaser som ble benyttet er Oria, Google Scholar, utdanningsdirektoratets hjemmeside og researchgate. Jeg benyttet Booth, et al. sin filtreringsprosess for litteratur utvalget. 
Resultat: Gjennom en systematisk analyse ble det avdekket fem nøkkelfaktorer som har endret seg i tråd med digitaliseringen, og påvirker hvordan undervisningen er strukturert, samt endrer didaktiske ideer. Ideen om digitale innfødte, perspektivet på danning, lærerens fagdidaktiske digitale kompetanse, individualiseringen av skolen og klasseledelse i et digitalt klasserom. Alle disse punktene er med på å utfylle hva problemstillingen prøver og besvare, samtidig som de belyser ulike aspekter ved digitaliseringen i skolen. 
Konklusjon: Digitaliseringen har endret store deler av skolen, og stiller dermed nye krav til hva som forventes av elevene. Denne endringen, kombinert med lærerens økte krav om digitale ferdigheter og kompetanser, skaper nye maler for undervisningen. Elevene kommer også inn i skolen med et helt annet forhold til det digitale, og krever ofte veiledning i hvordan en skal navigere i det digitale samfunnet. Relasjonen elevene har til teknologien er ofte knyttet til underholdning, noe som fører til at elevenes evne til å benytte teknologien som et læringsverktøy er ofte mangelfull. Videre har også skolen et danningsmandat, som innebærer å tilrettelegge for danning hos elevene slik at de kan delta i det digitale samfunnet.","MGUSA550","Master i grunnskolelærerutdanning 5. - 10. trinn, samfunnsfag. Høgskulen på Vestlandet","https://hdl.handle.net/11250/3154461","nob","Høgskulen på Vestlandet","http://creativecommons.org/licenses/by/4.0/deed.no","Navngivelse 4.0 Internasjonal","grunnskolelærerutdanning||samfunnsfag||digitalisering","Digitalization in schools – a displacement of didactical ideas","Digitaliseringen i skolen – en forskyvning av didaktiske ideer","Master thesis"
"f9b5340d-5bbe-4921-a7f4-195a7e6875e4","11250/285933","Sørfonn, Sofie",,"2024",,"Hensikten med denne studien har vært å finne ut hvordan musikk kan brukes som et virkemiddel for emosjonell kompetanse ved å undersøke hvilke følelsesmessige reaksjoner deltakerne har til musikk og hvordan musikk bidrar til forståelse og håndtering av følelser. For å finne ut av dette har jeg valgt å ta utgangspunkt i problemstillingen: 
På hvilke måter kan musikk brukes som et medierende middel for å fremme emosjonell kompetanse hos et utvalg 10.klassinger? 
For å finne svar på denne problemstillingen har jeg hentet data fra 10 elever ved 10.trinn. Alle elevene går på samme skole og utvalget består av 5 gutter og 5 jenter som ble intervjuet individuelt. Datamaterialet forteller om hvordan informantene forstår, uttrykker og regulerer følelser, som er tre av hovedpunktene innenfor definisjonen av emosjonell kompetanse. Defineringen av dette begrepet kan forklares som individuelle forskjeller i identifisering, forståelse, uttrykkelse, regulering og bruk av egne og andres følelser (Brasseur et al., 2013, s. 1). Regulering er en kategori som har kommet mye frem i datamaterialet, og har vært en stor del av masterarbeidet. Funnene forteller om hvordan musikk er en viktig del av den følelsesmessige reguleringen til utvalget elever ved 10.trinn, og er en stor faktor i deres psykiske velvære. Mange av informantene forklarte hvordan musikkundervisningen er en viktig del av skolehverdagen, som de setter stor pris på. Det er også nevnt hvordan de bruker musikk for å regulere, i tillegg til å bruke musikk for å fokusere bedre på både egne tanker, følelser, og gjennomføring av skolearbeid. 
Disse funnene synes jeg indikerer at musikk er en stor del av forvalting av emosjonell kompetanse, og den generelle hverdagen til elevene. Dette er noe som burde bli en mer bevisst faktor i gjennomføring av musisk arbeid i skolen, også fordi det har å gjøre med det tverrfaglige temaet folkehelse og livsmestring. Funnene vil også kunne hjelpe lærere med å få et innblikk i den musiske virkelighetsforståelsen hos ungdommene, og det vil kunne gi læreren en bedre forståelse for elever på en mer generell basis","MGUMU550","Master i grunnskolelærerutdanning 5. - 10. trinn, musikk. Høgskulen på Vestlandet, campus Bergen","https://hdl.handle.net/11250/3154862","nob","Høgskulen på Vestlandet","http://creativecommons.org/licenses/by/4.0/deed.no","Navngivelse 4.0 Internasjonal","grunnskolelærerutdanning||musikk","Music as a tool for emotional competence","Musikk som virkemiddel for emosjonell kompetanse","Master thesis"
