id,collection,dc.contributor.advisor,dc.contributor.author,dc.date.issued,dc.description,dc.description.abstract,dc.description.abstract[en_US],dc.description[en_US],dc.identifier,dc.identifier.citation[en_US],dc.identifier.uri,dc.language,dc.language.iso[en_US],dc.publisher,dc.publisher[en_US],dc.rights.holder[en_US],dc.rights.uri[*],dc.rights[*],dc.source.pagenumber[en_US],dc.subject.nsi[en_US],dc.subject[en_US],dc.title,dc.title[en_US],dc.type,dc.type[en_US]
"c00e8335-8526-452c-a24a-0b14292ebe32","11250/3034394","Haugen, Tommy","Rasmussen, Lone||Sørensen, Kristoffer Haraldseid","2024",,"Sammendrag
Alle elever har rett på tilpasset opplæring uavhengig av forutsetninger. Elever med fysiske funksjonsnedsettelser har gjerne behov for tilrettelegging, og kroppsøvingsfaget har vist seg å være en spesielt utfordrende arena, der de kan utsettes for segregerende og ekskluderende praksiser.

Læreren anses å være en sentral faktor for elevenes erfaringer i kroppsøvingsfaget. I denne studien undersøkte vi hvilke erfaringer kroppsøvingslærere har i møte med elever med fysiske funksjonsnedsettelser, for å forstå hvorfor slike praksiser skjer i kroppsøvingsfaget.

Vi anvendte kvalitativ metode for å undersøke problemstillingen, og gjennomførte seks individuelle, semistrukturerte intervjuer av kroppsøvingslærere ved fem forskjellige barne- og ungdomsskoler. Dataen ble analysert ved hjelp av refleksiv tematisk analyse. Det teoretiske grunnlaget i studien består av tidligere forskning og teori om diskurser, inkludering og lærerrollen.

I studien vår kom en rekke rammefaktorer fram som avgjørende for å imøtekomme læreplanens intensjoner. Hvorvidt disse muliggjorde inkluderende kroppsøvingsundervisning, så ut til å kunne være prisgitt tilfeldighetene. Lærerens vilje og evne til å se muligheter i lys av rammefaktorene spilte samtidig en vesentlig rolle, sett i sammenheng med diskurser i denne studien.

Lærerens diskurser hadde betydning for hvordan kroppsøvingsundervisningen ble tilpasset. Et argument for å gi eleven segregert undervisningsopplegg, var redselen for at tilpasningene skulle gå ut over «de andre» elevene. Det ble ansett som viktig at eleven deltok i det sosiale fellesskapet og fikk oppleve gevinsten av bevegelse. Disse to målene ble presentert som uforenelige for en elev med fysisk funksjonsnedsettelse.

Nøkkelord: diskurs, funksjonshemning, fysiske funksjonsnedsettelser, kroppsøvingslæreren,
rammefaktorer, tilpasset opplæring||",,,"no.uia:inspera:233856720:50748676",,"https://hdl.handle.net/11250/3142449","nob",,"University of Agder",,,,,,,,"""Jeg opplevde det så vanskelig at jeg etter hvert håpet eleven ikke kom"": En kvalitativ studie om kroppsøvingslæreres erfaringer med å tilpasse undervisningen til elever med fysiske funksjonsnedsettelser i den ordinære kroppsøvingsundervisningen.",,"Master thesis",
"c0ae59f9-99c0-4a5a-ae3b-b5d5b7659e87","11250/3034394","Jeppesen, Morten","Mjaaland, Eivind Skarmyr||Smerud, Hans Jonatan","2024",,"Forskning på demokrati i lærebøker etter innføringen av Kunnskapsløftet 2020 er begrenset ettersom at bøkene har vært tilgjengelige i relativt kort tid. Tidligere forskning har funnet en variert tilnærming til demokrati i norske lærebøker i samfunnsfag (Børhaug & Christophersen, 2012, s. 41-42). Denne masteroppgaven er en kvalitativ undersøkelse av 12 lærebøker i samfunnsfaget, for mellomtrinnet og ungdomstrinnet. Ettersom at demokratibegrepet er vidt og kan forstås på ulike måter, er oppgavens hensikt å undersøke hvordan dette fremstilles i lærebøker for samfunnsfaget. Oppgavens problemstilling lyder dermed: 

“Hvordan fremstiller et utvalg lærebøker i samfunnsfag på mellomtrinnet og ungdomstrinnet demokrati? ""I hvilken grad legger bøkene til rette for progresjon?”

For å besvare problemstillingen benytter vi idealtyper som analytisk rammeverk. Dette består av fire demokratiforståelser: liberal, republikansk, deliberativ og agonistisk. Videre har vi undersøkt hvilke av dimensjonene for demokratilæring (om, for og gjennom) som kommer til uttrykk i lærebøkene. For å si noe om i hvilken grad lærebøkene legger til rette for progresjon, undersøker vi i hvilken grad lærebøkene legger til rette for progresjon mellom sammenhengende kompetansemål etter 7. trinn og 10. trinn. 

Resultatene viser at alle demokratiforståelsene kommer til syne i lærebøkene, men at de i størst grad preges av en liberal demokratiforståelse. Den deliberative forståelsen kommer til syne i form av diskusjonsoppgaver. Selv om vi finner noen eksempler på en agonistisk forståelse, er forekomsten noe begrenset, og den kommer mest til syne ved ungdomstrinnet. Videre kommer om, for og gjennom til uttrykk, men om-dimensjonen er mest vektlagt. Vi finner en mindre vektlegging av for-dimensjonen, mens gjennom-dimensjonen trekkes frem i form av diskusjonsoppgaver. Til slutt finner vi at lærebøkene legger til progresjon, og at dette i størst grad skjer gjennom bruk av spiralprinsippet. Likevel finner vi en del innslag av (faglig-)logisk sekvensering. Psykologisk sekvensering kommer mindre til syne, og dette skjer i størst grad innad i kapitler. 

Basert på funnene våre mener vi at det er grunnlag for å sette spørsmål ved hvorvidt lærebøkene i tilstrekkelig grad klarer å realisere fagfornyelsens intensjoner.||",,,"no.uia:inspera:229826188:50451266",,"https://hdl.handle.net/11250/3143267","nob",,"University of Agder",,,,,,,,"Fremstilling av demokrati i lærebøker etter fagfornyelsen.",,"Master thesis",
"c1804ed5-5a9f-40c9-a046-5d1f01949d98","11250/3034394","Nyberg, Gunn","Langstad, Sander","2024",,"Denne masteroppgaven utforsker kjønnsforskjeller i kroppsøving med fokus på 
lærerutdanningen, gjennom å avdekke studenters oppfattelse av kjønn i faget. 
Problemstillingen tar utgangspunkt i hvordan studenter ved lærerutdanningen opplever å få 
kunnskap om de samfunnsmessige kjønnsforskjellene i kroppsøving, og hvilken kompetanse
de føler de får til å utfordre disse antagelsene i sin fremtidige undervisning.

Teorigrunnlaget for oppgaven er basert på Butlers (2006) performative kjønnsteori og 
fenomenologiske ideer fra Gallagher (2012). Dette fordi oppgaven undersøker hvordan 
samfunnsmessige forventninger til kjønn påvirker kroppsøvingsfaget og hvordan 
lærerutdanningen kan bidra til å gi fremtidige lærere kunnskap til å motvirke de antatte 
kjønnsforskjellene i faget. Metodisk benyttes en kvalitativ tilnærming med fenomenologiske 
intervjuer av masterstudenter. Dataene er samlet gjennom intervjuer med studenter som har 
gjennomført både første (30-60 studiepoeng) og andre syklus (150 studiepoeng) av 
lærerutdanningen i kroppsøving. Disse intervjuene gir innsikt i studentenes opplevelser og 
refleksjoner rundt kjønnsforskjeller i faget.

Resultatene viser at masterstudenter som har fullført både syklus 1 og syklus 2, har fått 
betydelig teoretisk kunnskap om kjønnsforskjeller. De har utviklet refleksjoner og bevissthet 
rundt problematikken, noe studentene i syklus 1 studenter. Videre uttrykker alle studentene en 
mangel på praktisk anvendbar kunnskap og føler seg utilstrekkelig forberedt på å 
implementere denne kunnskapen i praksis. Avslutningsvis konkluderer oppgaven med at selv 
om teoretisk innsikt er viktig, må utdanningen også fokusere på å gi studentene praktiske 
verktøy. Dette vil bedre forberede fremtidige lærere på å møte og utfordre kjønnsforskjeller, 
og dermed bidra til en mer likestilt kroppsøvingsundervisning.

Nøkkelord: Kjønn, kjønnsforskjeller, kroppsøving, lærerutdanningen, fenomenologi.||",,,"no.uia:inspera:233856720:50754562",,"https://hdl.handle.net/11250/3144112","nob",,"University of Agder",,,,,,,,"Maskulinitetens hegemoni i kroppsøvingsfaget",,"Master thesis",
"c3a8e957-3394-4081-8777-eb9c8738de94","11250/3034394","Mustad, Erik","Aamodt Bårnes, Christian","2023",,"This paper explores how the topic of the Civil Rights Movement is taught in Norwegian lower secondary schools in the English subject. The study aimed to investigate how teachers plan, teach, and assess the topic and how they utilize teaching methods and tools. The English and core curricula were also central in this paper, as they govern what teachers must teach their students. Semi-structured interviews with three English teachers and two textbooks were conducted to gather data for the project. The results showed that all three teachers used current events and news to teach the topic. They planned their lessons with colleagues and assessed the students’ oral skills after working on the topic. Furthermore, all teachers used parts of the textbook to teach the topic. The focus of the teaching seemed to be more on the content and not on language. The study’s small sample size makes it hard to generalize from the findings.||",,,"no.uia:inspera:143763411:23729981",,"https://hdl.handle.net/11250/3072947","",,"University of Agder",,,,,,,,"How the Civil Rights Movement is Taught in Norwegian Lower Secondary School",,"Master thesis",
"c49f4bfb-0624-4566-b4f5-4cf32f9b8622","11250/3034394","Garshol, Lenka","Ask, Pernille Flatner","2022",,"There is an increasing amount of studies on teachers' views on the use of L1 in the L2 classroom, while there are few studies on students' opinions on the topic. This study aims to explore Norwegian students' perceptions of the use of L1 in the L2 classroom, focusing on which situations and for what purposes they prefer L1 to be used. Three hundred and fifty students from different parts of Norway have participated in the study, and the results show that most students find the use of L1 helpful, seeing the L1 as a tool for language learning.||",,,"no.uia:inspera:107666473:21026322",,"https://hdl.handle.net/11250/3036537","",,"University of Agder",,,,,,,,"Students' Perceptions of Using L1 in the L2 Classroom",,"Master thesis",
"c6c81f67-a8c0-4515-bf93-d08e2f4ad095","11250/3034394","Alacaci, Cengiz||Brodahl, Cornelia","Nærland, Ingrid||Schellhorn, Marte","2022",,"I denne masteroppgaven har vi forsket på elever fra 8. og 10. trinn og hvordan de løser oppgaver med ulike kognitive krav. Formålet med dette var å undersøke om det skjer en endring gjennom ungdomsskolen. Vi undersøker problemstillingen ""Hvordan løser elever oppgaver ut fra ulike klassetrinn, og hvordan samsvarer dette med lærerens preferanse av oppgavene og forventninger til elevenes prestasjoner?"". For å kunne svare på denne problemstillingen, har vi delt den opp i tre forskningsspørsmål hvor vi ser på andel korrekte svar, metode for løsning og misoppfatninger, i tillegg til lærernes forutsigelser av elevenes prestasjoner. Vårt datamateriale består av elevers besvarelse av et oppgavesett og et spørreskjema til deres lærere. Oppgavene er problemløsningsoppgaver som omhandler volum og spørreskjemaet tar utgangspunkt i disse.||",,,"no.uia:inspera:109991212:21046587",,"https://hdl.handle.net/11250/3036547","",,"University of Agder",,,,,,,,"Elevers prestasjoner og lærernes forutsigelser

Students performance and teachers predictions",,"Master thesis",
"c8f54b03-1715-4ea3-a67f-abfd642ae26e","11250/3034394","Opheim, Linda Gurvin","Hjelmseth, Marianne Kjær||Lund, Tone","2024",,"Denne masteroppgaven fokuserer på matematisk modellering i eksamensoppgaver på 10.trinn med hensyn til kjerneelementet modellering og anvendelser. Modellering og anvendelser er ett av seks kjerneelementer i matematikk som ble innført med Læreplanverket for Kunnskapsløftet 2020 (LK20). Kjerneelementene er det viktigste faglige innholdet elevene skal arbeide med i opplæringen. Med bakgrunn i dette har vi utarbeidet følgende problemstilling: Hvilke muligheter har elever til å vise kompetanse i kjerneelementet modellering og anvendelser på skriftlig eksamen i matematikk etter innføringen av LK20?

Teorien i denne studien er knyttet til ulike perspektiver på matematisk modellering i matematikkundervisningen, matematiske kompetanser og ulike tilnærminger til matematisk modellering. Vi har redegjort for styringsdokumentene som ligger til grunn for eksamen i matematikk. Studien er en kvalitativ teoridrevet innholdsanalyse med en deduktiv tilnærming der hensikten er å få mer kunnskap om matematisk modellering i eksamensoppgaver. Analysen er gjennomført ved hjelp av et rammeverk som er basert på de syv stegene i modelleringssyklusen til Blum og Leiß (2007). I tillegg har vi brukt diagrammet for modelleringsprosessen til Zbiek og Conner (2006) for å synliggjøre stegene ytterligere.

Våre resultater viser at elevene har mulighet til å vise inntil seks av syv steg i modelleringssyklusen i de eksamenssettene vi har analysert. Utvidelsen vi har gjort av steget arbeide matematisk viser at dette steget er komplekst fordi det krever forskjellige tilnærminger til et matematisk problem. I 44 av 74 analyserte eksamensoppgaver er det nødvendig å gjøre to eller flere steg i modelleringssyklusen for å kunne svare på oppgaven. I fem av eksamensoppgavene er det nødvendig å gjøre fem eller seks steg, som er en tilnærmet helhetlig modelleringsprosess. Vi har i denne studien konkludert med at elevene har mulighet til å vise kompetanse i kjerneelementet modellering og anvendelser på skriftlig eksamen i matematikk. 

Nøkkelord: Matematisk modellering, kvalitativ teoridrevet innholdsanalyse, deduktiv tilnærming, kjerneelementeter, modellering og anvendelser, skriftlig eksamen i matematikk.||",,,"no.uia:inspera:229824458:48377284",,"https://hdl.handle.net/11250/3141017","nob",,"University of Agder",,,,,,,,"Matematisk modellering i eksamensoppgaver: En kvalitativ studie av eksamensoppgaver i matematikk for 10.trinn med hensyn til kjerneelementet modellering og anvendelser",,"Master thesis",
"ca652815-f70b-46f1-93d0-1e6e26eeeb77","11250/3034394","Reinhardtsen, Jorunn||Reid, David Alexander","Berdal, Sondre||Børresen, Jon Martin","2023",,"Temaet for masteroppgaven er algebraisk tenkning og forståelse. Tidligere studier viser til at elever i den norske skole opplever algebra som utfordrende (Kaarstein et al., 2020). Det vil derfor være hensiktsmessig å rette fokuset mot hvordan elever utrykker sin algebraiske tenkning og forståelse, for å videreutvikle undervisningen i skolen. Algebra og problemløsning er forankret i læreplanen (Kunnskapsdepartementet, 2019) og leder inn mot vår problemstilling. Forskningsspørsmålet som denne studien baserer seg på er: 

Hvordan kommer algebraisk tenkning og forståelse for begreper til syne i sammenheng med ekvivalens, uttrykk og likninger når elever på 7. trinn løser problemer ved bruk av regneark og hjelpetegninger? 

Som teoretisk rammeverk for analyse av empirien, går vi blant annet ut fra Blanton et al. (2015) sin idé om ekvivalens, uttrykk, likninger og ulikheter, og Kieran (2004) sin tilnærming til algebraisk tenkning. I denne sammenhengen har det teoretiske rammeverket bidratt til å oppdage deltagernes algebraiske tenkning og forståelse av ekvivalens, uttrykk og likninger i problemløsningsoppgaver. 

Denne forskningen er en kvalitativ multiple casestudie med oppgavebasert intervju. Innhentingen av data foregikk hos en 7. klasse på mellomtrinnet. Her ble det tatt i bruk lyd- og filmopptak, observasjoner og elevnotater. Undervisningsøktene ble brukt som et grunnlag for intervjuet av tre elever. Det er resultatene i de oppgavebaserte intervjuene som svarer på forskningsspørsmålet. Det oppgavebaserte intervjuet inneholdt tre problemløsningsoppgaver av algebraisk natur. Besvarelsene og resonneringen blant deltagerne var verdifulle i vår forskning da vi kunne vise til algebraisk tenkning og forståelse for begreper.   

Funnene i denne studien viser til varierende forståelse for begrepene og uttrykkelse av algebraisk tenkning. Samtlige deltagere fra intervjuet viser til aspekter til algebraisk tenkning og forståelse for begrepene i løsningen av gitte problemløsningsoppgaver. Det varierer mellom deltagerne hvordan og når de kommer til syne. En forståelse for ekvivalens, uttrykk og likninger og evnen til å tenke algebraisk viser seg både gjennom arbeid med penn og papir, samt under oppgaveløsning i Excel.||",,,"no.uia:inspera:143765519:37032194",,"https://hdl.handle.net/11250/3076242","",,"University of Agder",,,,,,,,"Aspekter av algebraisk tenkning i problemløsningsoppgaver:

En kvalitativ studie av elevers introduksjon og forståelse av algebra på mellomtrinnet.",,"Master thesis",
"cc8eb450-a9cf-4d14-b8bb-d24baad8d325","11250/3034394","Hasund, Ingrid Kristine","Bjørkmann, Walter","2024",,"Kommunikasjon anses som en essensiell del av engelskfaget, men lærere opplever ofte utfordringer med å oppmuntre elevene til å snakke engelsk. Selv om det finnes mye forskning på viljen til å kommunisere i engelskfaget og hvordan lærere kan øke deltakelsen, har det vært lite forskning på elevenes holdninger til dette problemet. Derfor undersøker den studien hva som hindrer elevene i å snakke engelsk og hvordan de mener lærere kan forbedre det kommunikative klasseromsmiljøet. Resultatene viser at elevene kan føle seg flau eller ukomfortable når de snakker engelsk og har en tendens til å bruke norsk i stedet. Imidlertid mener elevene at lærere, ved å snakke mer engelsk og bruke oppgaver med fokus på innhold, kan skape et trygt samtalemiljø og forbedre deres språkferdigheter.||",,,"no.uia:inspera:222051179:51858800",,"https://hdl.handle.net/11250/3135380","eng",,"University of Agder",,,,,,,,"Students’ Attitudes Towards Speaking English in the Classroom",,"Master thesis",
"cd0fb4bd-f22b-42e5-b5a2-2f3b3f262815","11250/3034394","Rambø, Gro Renée","Aas, Lise Mehlum||Eskeland, Helene","2022",,"Denne oppgaven handler om et utvalg norsklæreres syn på, og tanker rundt, det samiske i norskfaget på ungdomsskolen. Oppgaven baserer seg på en kvalitativ metode, i form av intervju med fire norsklærere. Denne oppgaven ser nærmere på hva som kan påvirke lærernes undervisningspraksiser knyttet til det samiske, og ser nærmere på i hvilken grad de spurte lærerne anser undervisning i samiske tema som viktig, og hvor stor plass det samiske har, blant annet i årsplaner. Det er benyttet teorier knyttet til blant annet teacher cognition, sosiokulturell læringsteori og flerspråklighet. Resultatene fra denne undersøkelsen viser at informantene oppgir at det samiske er viktig å undervise om, men at det settes av lite tid til dette arbeidet i årsplaner og i de forskjellige undervisningspraksisene. Resultatene peker også i retning av større kunnskapshull hos de spurte lærerne, og dette samsvarer også med tidligere gjennomførte undersøkelser gjort av blant annet Lile (2011). Funnene viser også at omgivelsene rundt læreren kan være med på å påvirke i hvor stor grad det samiske blir prioritert i undervisningspraksisene. Denne oppgaven viser også tendenser i retning av at de spurte lærerne har en ytre motivasjonsfaktor for å undervise i det samiske, og at det dreier seg om en forpliktelse i form av planverk.||",,,"no.uia:inspera:109925905:21522578",,"https://hdl.handle.net/11250/3036559","",,"University of Agder",,,,,,,,"Hva er et utvalg norsklæreres syn på, og tanker rundt, det samiske i norskfaget på ungdomsskolen?",,"Master thesis",
"cd7684b9-3a54-4d05-8379-b286093b4b8e","11250/3034394","Morten Beckmann","Attestog, Maria||Øygarden, Siri Lovise Raudsandmoen","2023",,"Denne oppgaven er en religionsdidaktisk oppgave om KRLE som holdningsdannende fag i skolen, med fokus på lærerens rolle i denne sammenheng. Hensikten med denne oppgaven er å finne ut på hvilken måte KRLE-faget er et holdningsdannende fag, og hvordan KRLE-lærere jobber med holdningsdannelse på ungdomstrinnet.  

I oppgaven ser vi nærmere på begrepet holdning, og viser til hvor dette kommer inn i KRLE-faget. Spesielt tar vi for oss holdningen toleranse. Vi bruker jødedomsundervisning på ungdomsskolen som utgangspunkt.

Formålet med denne oppgaven er å undersøke og belyse viktige faktorer når det kommer til KRLE som et holdningsdannende fag i skolen. Med vår oppgave håper vi på å være med på å fremme gode holdninger og verdier både blant barn og voksne, i skole og samfunn. Vi håper å få frem argumenter som viser at KRLE er et viktig fag i skolen for holdningsdannelse, som burde prioriteres. Vi håper at denne oppgaven kan være en inspirasjon for videre klasseromsforskning, og bidra til refleksjon rundt KRLE-lærere sin pedagogiske praksis.

Metoden i denne oppgaven er to semistrukturerte intervju av to ulike faglærere, samt to observasjoner av deres jødedomsundervisning.

Resultatet viser at Kunnskapsdepartementet gir skolen og lærerne en klar mulighet til å fungere som en mulighetsarena når det kommer til holdningsdannelse. Arbeid med holdningsdannelse kan forankres i læreplanen i KRLE. Likevel viser empirien at hvordan lærere velger å realisere disse mulighetene, som vil avgjøre i hvilken grad KRLE faktisk fungerer som et holdningsdannende fag. I denne oppgaven vil vi komme inn på ulike faktorer hos læreren som påvirker holdningsdannelsen i faget.||",,,"no.uia:inspera:143803085:37841128",,"https://hdl.handle.net/11250/3079261","",,"University of Agder",,,,,,,,"Skolen som mulighetsarena, og KRLE som et holdningsdannende fag - En kvalitativ studie av jødedomsundervisning i lys av LK20",,"Master thesis",
"cef0f103-5b26-4166-84b5-162bd88cc277","11250/3034394","Trysnes, Irene","Furre, Gina Skretting||Winther, Hanna Terjesen","2024",,"Formålet med masteroppgaven er å se på hvordan radikalisering og ekstremisme presenteres i lærebøker i samfunnsfag for ungdomstrinnet. Metodisk har vi benyttet en kombinasjon av kvalitative og kvantitative tilnærminger, der tematisk analyse har gitt innsikt i presentasjoner og innhold, supplert med opptelling av oppgaver og bilder. Problemstillingen som er utforsket i oppgaven lyder som følger: 

Hvordan og i hvilke sammenhenger presenteres radikalisering og ekstremisme i lærebøker for ungdomstrinnet i samfunnsfag? 

Vi har sett på hvordan og i hvilke sammenhenger det presenteres for elevene, samtidig som vi også har sett på hvordan innholdet samsvarer med føringene vi finner i gjeldende læreplan, som er Kunnskapsløftet 2020. Læreplanen legger føringer for vår valgte tematikk, samtidig som den er åpen, hvilket stiller store krav til lærebokforfatterne når det gjelder valg og fravalg av fagstoff. Det er imidlertid to relevante hendelser som spesifikt nevnes i læreplanen, nemlig terrorhendelsen 22.juli og holocaust. Vi finner at disse hendelsene gjennomgående er utfyllende tematisert i læreverkene. Et svært sentralt, og interessant funn, er imidlertid hvordan læreverkene presenterer terrorhendelsen 22.juli for elevene. Her finner vi en tendens til nordisk eksepsjonalisme, og til dels ubalanserte perspektiver, særlig, sammenlignet med andre terrorhendelser utenfor Norge som blir tatt opp i lærebøkene. Tilsvarende fremstilles norske nazister under andre verdenskrig som ofre, i motsetning til dagens ekstreme grupper som ganske gjennomgående defineres som terrorister.
 
Vi finner videre at de delene av læreplanen som er mer åpne blir tematisert i variert grad, og læreverkene vektlegger dette ulikt. Ut fra våre funn, er det lite som tilsier at det er vektlagt progresjon mellom bøkene. Et sentralt funn er at mye av innholdet er lagt til 10.trinn, og vi vil argumentere for at det hadde vært en fordel om elevene ble introdusert for og lærte om tematikken på et tidligere tidspunkt. Bøkene presenterer årsakssammenhenger til at mennesker blir radikaliserte og gjennomfører ekstreme handlinger, samt et forebyggingsfokus for å unngå ekstreme holdninger og handlinger, hvilket er i tråd med kompetansemål i samfunnsfag.||",,,"no.uia:inspera:229826188:20399854",,"https://hdl.handle.net/11250/3143273","nob",,"University of Agder",,,,,,,,"En analyse av lærebøker for ungdomstrinnet i samfunnsfag",,"Master thesis",
